Resource,Nesting,Resource Content Name,Flags,Cardinality,Datatype,Description
HealthcareService,HealthcareService.availableTime.allDay,allDay,,0..1,boolean,Always available? e.g. 24 hour service
HealthcareService,HealthcareService.availableTime.availableStartTime,availableStartTime,,0..1,time,Opening time of day (ignored if allDay = true)
HealthcareService,HealthcareService.availableTime.availableEndTime,availableEndTime,,0..1,time,Closing time of day (ignored if allDay = true)
HealthcareService,HealthcareService.notAvailable,notAvailable,,0..*,BackboneElement,Not available during this time due to provided reason
HealthcareService,HealthcareService.notAvailable.description,description,,1..1,string,Reason presented to the user explaining why time not available
HealthcareService,HealthcareService.notAvailable.during,during,,0..1,Period,Service not availablefrom this date
HealthcareService,HealthcareService.availabilityExceptions,availabilityExceptions,,0..1,string,Description of availability exceptions
HealthcareService,HealthcareService.endpoint,endpoint,,0..*,Reference(Endpoint),Technical endpoints providing access to services operated for the location
ImagingManifest,ImagingManifest.id,id,Σ,0..1,id,Logical id of this artifact
ImagingManifest,ImagingManifest.meta,meta,Σ,0..1,Meta,Metadata about the resource
ImagingManifest,ImagingManifest.implicitRules,implicitRules,?! Σ,0..1,uri,A set of rules under which this content was created
ImagingManifest,ImagingManifest.language,language,,0..1,code,Language of the resource contentLanguage  (Required)
ImagingManifest,ImagingManifest.text,text,I,0..1,Narrative,"Text summary of the resource, for human interpretation"
ImagingManifest,ImagingManifest.contained,contained,,0..*,Resource,"Contained, inline Resources"
ImagingManifest,ImagingManifest.extension,extension,,0..*,Extension,Additional Content defined by implementations
ImagingManifest,ImagingManifest.modifierExtension,modifierExtension,?!,0..*,Extension,Extensions that cannot be ignored
ImagingManifest,ImagingManifest,ImagingManifest,,,DomainResource,"Key Object SelectionElements defined in Ancestors: id, meta, implicitRules, language, text, contained, extension, modifierExtension"
ImagingManifest,ImagingManifest.identifier,identifier,Σ,0..1,Identifier,SOP Instance UID
ImagingManifest,ImagingManifest.patient,patient,Σ,1..1,Reference(Patient),Patient of the selected objects
ImagingManifest,ImagingManifest.authoringTime,authoringTime,Σ,0..1,dateTime,Time when the selection of instances was made
ImagingManifest,ImagingManifest.author,author,Σ,0..1,Reference(Practitioner | Device | Organization | Patient | RelatedPerson),Author (human or machine)
ImagingManifest,ImagingManifest.description,description,Σ,0..1,string,Description text
ImagingManifest,ImagingManifest.study,study,Σ,1..*,BackboneElement,Study identity of the selected instances
ImagingManifest,ImagingManifest.study.uid,uid,Σ,1..1,oid,Study instance UID
ImagingManifest,ImagingManifest.study.imagingStudy,imagingStudy,Σ,0..1,Reference(ImagingStudy),Reference to ImagingStudy
ImagingManifest,ImagingManifest.study.endpoint,endpoint,Σ,0..*,Reference(Endpoint),Study access service endpoint
ImagingManifest,ImagingManifest.study.series,series,Σ,1..*,BackboneElement,Series identity of the selected instances
ImagingManifest,ImagingManifest.study.series.uid,uid,Σ,1..1,oid,Series instance UID
ImagingManifest,ImagingManifest.study.series.endpoint,endpoint,Σ,0..*,Reference(Endpoint),Series access endpoint
ImagingManifest,ImagingManifest.study.series.instance,instance,Σ,1..*,BackboneElement,The selected instance
ImagingManifest,ImagingManifest.study.series.instance.sopClass,sopClass,Σ,1..1,oid,SOP class UID of instance
ImagingManifest,ImagingManifest.study.series.instance.uid,uid,Σ,1..1,oid,Selected instance UID
ImagingStudy,ImagingStudy.id,id,Σ,0..1,id,Logical id of this artifact
ImagingStudy,ImagingStudy.meta,meta,Σ,0..1,Meta,Metadata about the resource
ImagingStudy,ImagingStudy.implicitRules,implicitRules,?! Σ,0..1,uri,A set of rules under which this content was created
ImagingStudy,ImagingStudy.language,language,,0..1,code,Language of the resource contentLanguage  (Required)
ImagingStudy,ImagingStudy.text,text,I,0..1,Narrative,"Text summary of the resource, for human interpretation"
ImagingStudy,ImagingStudy.contained,contained,,0..*,Resource,"Contained, inline Resources"
ImagingStudy,ImagingStudy.extension,extension,,0..*,Extension,Additional Content defined by implementations
ImagingStudy,ImagingStudy.modifierExtension,modifierExtension,?!,0..*,Extension,Extensions that cannot be ignored
ImagingStudy,ImagingStudy,ImagingStudy,,,DomainResource,"A set of images produced in single study (one or more series of references images)Elements defined in Ancestors: id, meta, implicitRules, language, text, contained, extension, modifierExtension"
ImagingStudy,ImagingStudy.uid,uid,Σ,1..1,oid,Formal DICOM identifier for the study
ImagingStudy,ImagingStudy.accession,accession,Σ,0..1,Identifier,"Related workflow identifier (""Accession Number"")"
ImagingStudy,ImagingStudy.identifier,identifier,Σ,0..*,Identifier,Other identifiers for the study
ImagingStudy,ImagingStudy.availability,availability,Σ,0..1,code,ONLINE | OFFLINE | NEARLINE | UNAVAILABLEInstanceAvailability (Required)
ImagingStudy,ImagingStudy.modalityList,modalityList,Σ,0..*,Coding,All series modality if actual acquisition modalitiesAcquisition Modality Codes (Extensible)
ImagingStudy,ImagingStudy.patient,patient,Σ,1..1,Reference(Patient),Who the images are of
ImagingStudy,ImagingStudy.context,context,Σ,0..1,Reference(Encounter | EpisodeOfCare),Originating context
ImagingStudy,ImagingStudy.started,started,Σ,0..1,dateTime,When the study was started
ImagingStudy,ImagingStudy.basedOn,basedOn,Σ,0..*,Reference(ReferralRequest | CarePlan | ProcedureRequest),Request fulfilled
ImagingStudy,ImagingStudy.referrer,referrer,Σ,0..1,Reference(Practitioner),Referring physician
ImagingStudy,ImagingStudy.interpreter,interpreter,Σ,0..*,Reference(Practitioner),Who interpreted images
ImagingStudy,ImagingStudy.endpoint,endpoint,Σ,0..*,Reference(Endpoint),Study access endpoint
ImagingStudy,ImagingStudy.numberOfSeries,numberOfSeries,Σ,0..1,unsignedInt,Number of Study Related Series
ImagingStudy,ImagingStudy.numberOfInstances,numberOfInstances,Σ,0..1,unsignedInt,Number of Study Related Instances
ImagingStudy,ImagingStudy.procedureReference,procedureReference,Σ,0..*,Reference(Procedure),The performed Procedure reference
ImagingStudy,ImagingStudy.procedureCode,procedureCode,Σ,0..*,CodeableConcept,The performed procedure codeProcedure Codes (SNOMED CT) (Example)
ImagingStudy,ImagingStudy.reason,reason,Σ,0..1,CodeableConcept,Why the study was requestedProcedure Reason Codes (Example)
ImagingStudy,ImagingStudy.description,description,Σ,0..1,string,Institution-generated description
ImagingStudy,ImagingStudy.series,series,Σ,0..*,BackboneElement,Each study has one or more series of instances
ImagingStudy,ImagingStudy.series.uid,uid,Σ,1..1,oid,Formal DICOM identifier for this series
ImagingStudy,ImagingStudy.series.number,number,Σ,0..1,unsignedInt,Numeric identifier of this series
ImagingStudy,ImagingStudy.series.modality,modality,Σ,1..1,Coding,The modality of the instances in the seriesAcquisition Modality Codes (Extensible)
ImagingStudy,ImagingStudy.series.description,description,Σ,0..1,string,A short human readable summary of the series
ImagingStudy,ImagingStudy.series.numberOfInstances,numberOfInstances,Σ,0..1,unsignedInt,Number of Series Related Instances
ImagingStudy,ImagingStudy.series.availability,availability,Σ,0..1,code,ONLINE | OFFLINE | NEARLINE | UNAVAILABLEInstanceAvailability (Required)
ImagingStudy,ImagingStudy.series.endpoint,endpoint,Σ,0..*,Reference(Endpoint),Series access endpoint
ImagingStudy,ImagingStudy.series.bodySite,bodySite,Σ,0..1,Coding,Body part examinedSNOMED CT Body Structures (Example)
ImagingStudy,ImagingStudy.series.laterality,laterality,Σ,0..1,Coding,Body part lateralityLaterality (Example)
ImagingStudy,ImagingStudy.series.started,started,Σ,0..1,dateTime,When the series started
ImagingStudy,ImagingStudy.series.performer,performer,Σ,0..*,Reference(Practitioner),Who performed the series
ImagingStudy,ImagingStudy.series.instance,instance,,0..*,BackboneElement,A single SOP instance from the series
ImagingStudy,ImagingStudy.series.instance.uid,uid,,1..1,oid,Formal DICOM identifier for this instance
ImagingStudy,ImagingStudy.series.instance.number,number,,0..1,unsignedInt,The number of this instance in the series
ImagingStudy,ImagingStudy.series.instance.sopClass,sopClass,,1..1,oid,DICOM class type
ImagingStudy,ImagingStudy.series.instance.title,title,,0..1,string,Description of instance
Immunization,Immunization.id,id,Σ,0..1,id,Logical id of this artifact
Immunization,Immunization.meta,meta,Σ,0..1,Meta,Metadata about the resource
Immunization,Immunization.implicitRules,implicitRules,?! Σ,0..1,uri,A set of rules under which this content was created
Immunization,Immunization.language,language,,0..1,code,Language of the resource contentLanguage  (Required)
Immunization,Immunization.text,text,I,0..1,Narrative,"Text summary of the resource, for human interpretation"
Immunization,Immunization.contained,contained,,0..*,Resource,"Contained, inline Resources"
Immunization,Immunization.extension,extension,,0..*,Extension,Additional Content defined by implementations
Immunization,Immunization.modifierExtension,modifierExtension,?!,0..*,Extension,Extensions that cannot be ignored
Immunization,Immunization,Immunization,I,,DomainResource,"Immunization event information+ If immunization was administered (notGiven=false) then explanation.reasonNotGiven SHALL be absent.+ If immunization was not administered (notGiven=true) then there SHALL be no reaction nor explanation.reason presentElements defined in Ancestors: id, meta, implicitRules, language, text, contained, extension, modifierExtension"
Immunization,Immunization.identifier,identifier,,0..*,Identifier,Business identifier
Immunization,Immunization.status,status,?!Σ,1..1,code,completed | entered-in-errorImmunization Status Codes (Required)
Immunization,Immunization.notGiven,notGiven,?!Σ,1..1,boolean,Flag for whether immunization was given
Immunization,Immunization.vaccineCode,vaccineCode,,1..1,CodeableConcept,Vaccine product administeredVaccine Administered Value Set (Example)
Immunization,Immunization.patient,patient,,1..1,Reference(Patient),Who was immunized
Immunization,Immunization.encounter,encounter,,0..1,Reference(Encounter),Encounter administered as part of
Immunization,Immunization.date,date,,0..1,dateTime,Vaccination administration date
Immunization,Immunization.primarySource,primarySource,,1..1,boolean,Indicates context the data was recorded in
Immunization,Immunization.reportOrigin,reportOrigin,,0..1,CodeableConcept,Indicates the source of a secondarily reported recordImmunization Origin Codes (Example)
Immunization,Immunization.location,location,,0..1,Reference(Location),Where vaccination occurred
Immunization,Immunization.manufacturer,manufacturer,,0..1,Reference(Organization),Vaccine manufacturer
Immunization,Immunization.lotNumber,lotNumber,,0..1,string,Vaccine lot number
Immunization,Immunization.expirationDate,expirationDate,,0..1,date,Vaccine expiration date
Immunization,Immunization.site,site,,0..1,CodeableConcept,Body site vaccine  was administeredCodes for Immunization Site of Administration (Example)
Immunization,Immunization.route,route,,0..1,CodeableConcept,How vaccine entered bodyImmunization Route Codes (Example)
Immunization,Immunization.doseQuantity,doseQuantity,,0..1,SimpleQuantity,Amount of vaccine administered
Immunization,Immunization.practitioner,practitioner,Σ,0..*,BackboneElement,Who performed event
Immunization,Immunization.practitioner.role,role,Σ,0..1,CodeableConcept,What type of performance was doneImmunization Role Codes (Extensible)
Immunization,Immunization.practitioner.actor,actor,Σ,1..1,Reference(Practitioner),Individual who was performing
Immunization,Immunization.note,note,Σ,0..*,Annotation,Vaccination notes
Immunization,Immunization.explanation,explanation,,0..1,BackboneElement,Administration/non-administration reasons
Immunization,Immunization.explanation.reason,reason,,0..*,CodeableConcept,Why immunization occurredImmunization Reason Codes (Example)
Immunization,Immunization.explanation.reasonNotGiven,reasonNotGiven,,0..*,CodeableConcept,Why immunization did not occurImmunization Reasons for Not Immunizing Codes (Example)
Immunization,Immunization.reaction,reaction,,0..*,BackboneElement,Details of a reaction that follows immunization
Immunization,Immunization.reaction.date,date,,0..1,dateTime,When reaction started
Immunization,Immunization.reaction.detail,detail,,0..1,Reference(Observation),Additional information on reaction
Immunization,Immunization.reaction.reported,reported,,0..1,boolean,Indicates self-reported reaction
Immunization,Immunization.vaccinationProtocol,vaccinationProtocol,,0..*,BackboneElement,What protocol was followed
Immunization,Immunization.vaccinationProtocol.doseSequence,doseSequence,,0..1,positiveInt,Dose number within series
Immunization,Immunization.vaccinationProtocol.description,description,,0..1,string,Details of vaccine protocol
Immunization,Immunization.vaccinationProtocol.authority,authority,,0..1,Reference(Organization),Who is responsible for protocol
Immunization,Immunization.vaccinationProtocol.series,series,,0..1,string,Name of vaccine series
Immunization,Immunization.vaccinationProtocol.seriesDoses,seriesDoses,,0..1,positiveInt,Recommended number of doses for immunity
Immunization,Immunization.vaccinationProtocol.targetDisease,targetDisease,,1..*,CodeableConcept,Disease immunized againstVaccination Protocol Dose Target Codes (Example)
Immunization,Immunization.vaccinationProtocol.doseStatus,doseStatus,,1..1,CodeableConcept,Indicates if dose counts towards immunityVaccination Protocol Dose Status codes (Example)
Immunization,Immunization.vaccinationProtocol.doseStatusReason,doseStatusReason,,0..1,CodeableConcept,Why dose does (not) countVaccination Protocol Dose Status Reason codes (Example)
ImmunizationRecommendation,ImmunizationRecommendation.id,id,Σ,0..1,id,Logical id of this artifact
ImmunizationRecommendation,ImmunizationRecommendation.meta,meta,Σ,0..1,Meta,Metadata about the resource
ImmunizationRecommendation,ImmunizationRecommendation.implicitRules,implicitRules,?! Σ,0..1,uri,A set of rules under which this content was created
ImmunizationRecommendation,ImmunizationRecommendation.language,language,,0..1,code,Language of the resource contentLanguage  (Required)
ImmunizationRecommendation,ImmunizationRecommendation.text,text,I,0..1,Narrative,"Text summary of the resource, for human interpretation"
ImmunizationRecommendation,ImmunizationRecommendation.contained,contained,,0..*,Resource,"Contained, inline Resources"
ImmunizationRecommendation,ImmunizationRecommendation.extension,extension,,0..*,Extension,Additional Content defined by implementations
ImmunizationRecommendation,ImmunizationRecommendation.modifierExtension,modifierExtension,?!,0..*,Extension,Extensions that cannot be ignored
ImmunizationRecommendation,ImmunizationRecommendation,ImmunizationRecommendation,,,DomainResource,"Guidance or advice relating to an immunizationElements defined in Ancestors: id, meta, implicitRules, language, text, contained, extension, modifierExtension"
ImmunizationRecommendation,ImmunizationRecommendation.identifier,identifier,Σ,0..*,Identifier,Business identifier
ImmunizationRecommendation,ImmunizationRecommendation.patient,patient,Σ,1..1,Reference(Patient),Who this profile is for
ImmunizationRecommendation,ImmunizationRecommendation.recommendation,recommendation,ΣI,1..*,BackboneElement,Vaccine administration recommendations+ One of vaccineCode or targetDisease SHALL be present
ImmunizationRecommendation,ImmunizationRecommendation.recommendation.date,date,Σ,1..1,dateTime,Date recommendation created
ImmunizationRecommendation,ImmunizationRecommendation.recommendation.vaccineCode,vaccineCode,Σ,0..1,CodeableConcept,Vaccine recommendation applies toVaccine Administered Value Set (Example)
ImmunizationRecommendation,ImmunizationRecommendation.recommendation.targetDisease,targetDisease,Σ,0..1,CodeableConcept,Disease to be immunized againstImmunization Recommendation Target Disease Codes (Example)
ImmunizationRecommendation,ImmunizationRecommendation.recommendation.doseNumber,doseNumber,Σ,0..1,positiveInt,Recommended dose number
ImmunizationRecommendation,ImmunizationRecommendation.recommendation.forecastStatus,forecastStatus,Σ,1..1,CodeableConcept,Vaccine administration statusImmunization Recommendation Status Codes (Example)
ImmunizationRecommendation,ImmunizationRecommendation.recommendation.dateCriterion,dateCriterion,,0..*,BackboneElement,Dates governing proposed immunization
ImmunizationRecommendation,ImmunizationRecommendation.recommendation.dateCriterion.code,code,,1..1,CodeableConcept,Type of dateImmunization Recommendation Date Criterion Codes (Example)
ImmunizationRecommendation,ImmunizationRecommendation.recommendation.dateCriterion.value,value,,1..1,dateTime,Recommended date
ImmunizationRecommendation,ImmunizationRecommendation.recommendation.protocol,protocol,,0..1,BackboneElement,Protocol used by recommendation
ImmunizationRecommendation,ImmunizationRecommendation.recommendation.protocol.doseSequence,doseSequence,,0..1,positiveInt,Dose number within sequence
ImmunizationRecommendation,ImmunizationRecommendation.recommendation.protocol.description,description,,0..1,string,Protocol details
ImmunizationRecommendation,ImmunizationRecommendation.recommendation.protocol.authority,authority,,0..1,Reference(Organization),Who is responsible for protocol
ImmunizationRecommendation,ImmunizationRecommendation.recommendation.protocol.series,series,,0..1,string,Name of vaccination series
ImmunizationRecommendation,ImmunizationRecommendation.recommendation.supportingImmunization,supportingImmunization,,0..*,Reference(Immunization),Past immunizations supporting recommendation
ImmunizationRecommendation,ImmunizationRecommendation.recommendation.supportingPatientInformation,supportingPatientInformation,,0..*,Reference(Observation | AllergyIntolerance),Patient observations supporting recommendation
ImplementationGuide,ImplementationGuide.id,id,Σ,0..1,id,Logical id of this artifact
ImplementationGuide,ImplementationGuide.meta,meta,Σ,0..1,Meta,Metadata about the resource
ImplementationGuide,ImplementationGuide.implicitRules,implicitRules,?! Σ,0..1,uri,A set of rules under which this content was created
ImplementationGuide,ImplementationGuide.language,language,,0..1,code,Language of the resource contentLanguage  (Required)
ImplementationGuide,ImplementationGuide.text,text,I,0..1,Narrative,"Text summary of the resource, for human interpretation"
ImplementationGuide,ImplementationGuide.contained,contained,,0..*,Resource,"Contained, inline Resources"
ImplementationGuide,ImplementationGuide.extension,extension,,0..*,Extension,Additional Content defined by implementations
ImplementationGuide,ImplementationGuide.modifierExtension,modifierExtension,?!,0..*,Extension,Extensions that cannot be ignored
ImplementationGuide,ImplementationGuide,ImplementationGuide,,,DomainResource,"A set of rules about how FHIR is usedElements defined in Ancestors: id, meta, implicitRules, language, text, contained, extension, modifierExtension"
ImplementationGuide,ImplementationGuide.url,url,Σ,1..1,uri,Logical URI to reference this implementation guide (globally unique)
ImplementationGuide,ImplementationGuide.version,version,Σ,0..1,string,Business version of the implementation guide
ImplementationGuide,ImplementationGuide.name,name,Σ,1..1,string,Name for this implementation guide (computer friendly)
ImplementationGuide,ImplementationGuide.status,status,?!Σ,1..1,code,draft | active | retired | unknownPublicationStatus (Required)
ImplementationGuide,ImplementationGuide.experimental,experimental,?!Σ,0..1,boolean,"For testing purposes, not real usage"
ImplementationGuide,ImplementationGuide.date,date,Σ,0..1,dateTime,Date this was last changed
ImplementationGuide,ImplementationGuide.publisher,publisher,Σ,0..1,string,Name of the publisher (organization or individual)
ImplementationGuide,ImplementationGuide.contact,contact,Σ,0..*,ContactDetail,Contact details for the publisher
ImplementationGuide,ImplementationGuide.description,description,,0..1,markdown,Natural language description of the implementation guide
ImplementationGuide,ImplementationGuide.useContext,useContext,Σ,0..*,UsageContext,Context the content is intended to support
ImplementationGuide,ImplementationGuide.jurisdiction,jurisdiction,Σ,0..*,CodeableConcept,Intended jurisdiction for implementation guide (if applicable)Jurisdiction ValueSet (Extensible)
ImplementationGuide,ImplementationGuide.copyright,copyright,,0..1,markdown,Use and/or publishing restrictions
ImplementationGuide,ImplementationGuide.fhirVersion,fhirVersion,Σ,0..1,id,FHIR Version this Implementation Guide targets
ImplementationGuide,ImplementationGuide.dependency,dependency,Σ,0..*,BackboneElement,Another Implementation guide this depends on
ImplementationGuide,ImplementationGuide.dependency.type,type,Σ,1..1,code,reference | inclusionGuideDependencyType (Required)
ImplementationGuide,ImplementationGuide.dependency.uri,uri,Σ,1..1,uri,Where to find dependency
ImplementationGuide,ImplementationGuide.package,package,Σ,0..*,BackboneElement,Group of resources as used in .page.package
ImplementationGuide,ImplementationGuide.package.name,name,Σ,1..1,string,Name used .page.package
ImplementationGuide,ImplementationGuide.package.description,description,,0..1,string,Human readable text describing the package
ImplementationGuide,ImplementationGuide.package.resource,resource,Σ,1..*,BackboneElement,Resource in the implementation guide
ImplementationGuide,ImplementationGuide.package.resource.example,example,Σ,1..1,boolean,"If not an example, has its normal meaning"
ImplementationGuide,ImplementationGuide.package.resource.name,name,Σ,0..1,string,Human Name for the resource
ImplementationGuide,ImplementationGuide.package.resource.description,description,,0..1,string,Reason why included in guide
ImplementationGuide,ImplementationGuide.package.resource.acronym,acronym,,0..1,string,Short code to identify the resource
ImplementationGuide,ImplementationGuide.package.resource.source[x],source[x],Σ,1..1,,Location of the resource
ImplementationGuide,ImplementationGuide.package.resource.sourceUri,sourceUri,,,uri,
ImplementationGuide,ImplementationGuide.package.resource.sourceReference,sourceReference,,,Reference(Any),
ImplementationGuide,ImplementationGuide.package.resource.exampleFor,exampleFor,,0..1,Reference(StructureDefinition),Resource this is an example of (if applicable)
ImplementationGuide,ImplementationGuide.global,global,Σ,0..*,BackboneElement,Profiles that apply globally
ImplementationGuide,ImplementationGuide.global.type,type,Σ,1..1,code,Type this profiles applies toResourceType (Required)
ImplementationGuide,ImplementationGuide.global.profile,profile,Σ,1..1,Reference(StructureDefinition),Profile that all resources must conform to
ImplementationGuide,ImplementationGuide.binary,binary,,0..*,uri,"Image, css, script, etc."
ImplementationGuide,ImplementationGuide.page,page,Σ,0..1,BackboneElement,Page/Section in the Guide
ImplementationGuide,ImplementationGuide.page.source,source,Σ,1..1,uri,Where to find that page
ImplementationGuide,ImplementationGuide.page.title,title,Σ,1..1,string,Short title shown for navigational assistance
ImplementationGuide,ImplementationGuide.page.kind,kind,Σ,1..1,code,page | example | list | include | directory | dictionary | toc | resourceGuidePageKind (Required)
ImplementationGuide,ImplementationGuide.page.type,type,,0..*,code,Kind of resource to include in the listResourceType (Required)
ImplementationGuide,ImplementationGuide.page.package,package,,0..*,string,Name of package to include
ImplementationGuide,ImplementationGuide.page.format,format,,0..1,code,"Format of the page (e.g. html, markdown, etc.)MimeType  (Required)"
ImplementationGuide,ImplementationGuide.page.page,page,,0..*,see page,Nested Pages / Sections
Library,Library.id,id,Σ,0..1,id,Logical id of this artifact
Library,Library.meta,meta,Σ,0..1,Meta,Metadata about the resource
Library,Library.implicitRules,implicitRules,?! Σ,0..1,uri,A set of rules under which this content was created
Library,Library.language,language,,0..1,code,Language of the resource contentLanguage  (Required)
Library,Library.text,text,I,0..1,Narrative,"Text summary of the resource, for human interpretation"
Library,Library.contained,contained,,0..*,Resource,"Contained, inline Resources"
Library,Library.extension,extension,,0..*,Extension,Additional Content defined by implementations
Library,Library.modifierExtension,modifierExtension,?!,0..*,Extension,Extensions that cannot be ignored
Library,Library,Library,,,DomainResource,"Represents a library of quality improvement componentsElements defined in Ancestors: id, meta, implicitRules, language, text, contained, extension, modifierExtension"
Library,Library.url,url,Σ,0..1,uri,Logical URI to reference this library (globally unique)
Library,Library.identifier,identifier,Σ,0..*,Identifier,Additional identifier for the library
Library,Library.version,version,Σ,0..1,string,Business version of the library
Library,Library.name,name,Σ,0..1,string,Name for this library (computer friendly)
Library,Library.title,title,Σ,0..1,string,Name for this library (human friendly)
