Resource,Nesting,Resource Content Name,Flags,Cardinality,Datatype,Description
ImmunizationRecommendation,Resource.DomainResource.ImmunizationRecommendation.recommendation.protocol, doseSequence ,,0..1,positiveInt,Dose number within sequence
ImmunizationRecommendation,Resource.DomainResource.ImmunizationRecommendation.recommendation.protocol, description ,,0..1,string,Protocol details
ImmunizationRecommendation,Resource.DomainResource.ImmunizationRecommendation.recommendation.protocol, authority ,,0..1,Reference(Organization),Who is responsible for protocol
ImmunizationRecommendation,Resource.DomainResource.ImmunizationRecommendation.recommendation.protocol, series ,,0..1,string,Name of vaccination series
ImmunizationRecommendation,Resource.DomainResource.ImmunizationRecommendation.recommendation, supportingImmunization ,,0..*,Reference(Immunization),Past immunizations supporting recommendation
ImmunizationRecommendation,Resource.DomainResource.ImmunizationRecommendation.recommendation, supportingPatientInformation ,,0..*,Reference(Observation | AllergyIntolerance),Patient observations supporting recommendation
ImplementationGuide,Resource.DomainResource.ImplementationGuide, ImplementationGuide ,,,DomainResource,"A set of rules about how FHIR is usedElements defined in Ancestors: id, meta, implicitRules, language, text, contained, extension, modifierExtension"
ImplementationGuide,Resource.DomainResource.ImplementationGuide, url ,Σ,1..1,uri,Logical URI to reference this implementation guide (globally unique)
ImplementationGuide,Resource.DomainResource.ImplementationGuide, version ,Σ,0..1,string,Business version of the implementation guide
ImplementationGuide,Resource.DomainResource.ImplementationGuide, name ,Σ,1..1,string,Name for this implementation guide (computer friendly)
ImplementationGuide,Resource.DomainResource.ImplementationGuide, status ,?!Σ,1..1,code,draft | active | retired | unknownPublicationStatus (Required)
ImplementationGuide,Resource.DomainResource.ImplementationGuide, experimental ,?!Σ,0..1,boolean,"For testing purposes, not real usage"
ImplementationGuide,Resource.DomainResource.ImplementationGuide, date ,Σ,0..1,dateTime,Date this was last changed
ImplementationGuide,Resource.DomainResource.ImplementationGuide, publisher ,Σ,0..1,string,Name of the publisher (organization or individual)
ImplementationGuide,Resource.DomainResource.ImplementationGuide, contact ,Σ,0..*,ContactDetail,Contact details for the publisher
ImplementationGuide,Resource.DomainResource.ImplementationGuide, description ,,0..1,markdown,Natural language description of the implementation guide
ImplementationGuide,Resource.DomainResource.ImplementationGuide, useContext ,Σ,0..*,UsageContext,Context the content is intended to support
ImplementationGuide,Resource.DomainResource.ImplementationGuide, jurisdiction ,Σ,0..*,CodeableConcept,Intended jurisdiction for implementation guide (if applicable)Jurisdiction ValueSet (Extensible)
ImplementationGuide,Resource.DomainResource.ImplementationGuide, copyright ,,0..1,markdown,Use and/or publishing restrictions
ImplementationGuide,Resource.DomainResource.ImplementationGuide, fhirVersion ,Σ,0..1,id,FHIR Version this Implementation Guide targets
ImplementationGuide,Resource.DomainResource.ImplementationGuide, dependency ,Σ,0..*,BackboneElement,Another Implementation guide this depends on
ImplementationGuide,Resource.DomainResource.ImplementationGuide.dependency, type ,Σ,1..1,code,reference | inclusionGuideDependencyType (Required)
ImplementationGuide,Resource.DomainResource.ImplementationGuide.dependency, uri ,Σ,1..1,uri,Where to find dependency
ImplementationGuide,Resource.DomainResource.ImplementationGuide, package ,Σ,0..*,BackboneElement,Group of resources as used in .page.package
ImplementationGuide,Resource.DomainResource.ImplementationGuide.package, name ,Σ,1..1,string,Name used .page.package
ImplementationGuide,Resource.DomainResource.ImplementationGuide.package, description ,,0..1,string,Human readable text describing the package
ImplementationGuide,Resource.DomainResource.ImplementationGuide.package, resource ,Σ,1..*,BackboneElement,Resource in the implementation guide
ImplementationGuide,Resource.DomainResource.ImplementationGuide.package.resource, example ,Σ,1..1,boolean,"If not an example, has its normal meaning"
ImplementationGuide,Resource.DomainResource.ImplementationGuide.package.resource, name ,Σ,0..1,string,Human Name for the resource
ImplementationGuide,Resource.DomainResource.ImplementationGuide.package.resource, description ,,0..1,string,Reason why included in guide
ImplementationGuide,Resource.DomainResource.ImplementationGuide.package.resource, acronym ,,0..1,string,Short code to identify the resource
ImplementationGuide,Resource.DomainResource.ImplementationGuide.package.resource, source[x] ,Σ,1..1,,Location of the resource
ImplementationGuide,ImplementationGuide.package.resource.source[x], sourceUri,,,uri,
ImplementationGuide,ImplementationGuide.package.resource.source[x], sourceReference,,,Reference(Any),
ImplementationGuide,Resource.DomainResource.ImplementationGuide.package.resource, exampleFor ,,0..1,Reference(StructureDefinition),Resource this is an example of (if applicable)
ImplementationGuide,Resource.DomainResource.ImplementationGuide, global ,Σ,0..*,BackboneElement,Profiles that apply globally
ImplementationGuide,Resource.DomainResource.ImplementationGuide.global, type ,Σ,1..1,code,Type this profiles applies toResourceType (Required)
ImplementationGuide,Resource.DomainResource.ImplementationGuide.global, profile ,Σ,1..1,Reference(StructureDefinition),Profile that all resources must conform to
ImplementationGuide,Resource.DomainResource.ImplementationGuide, binary ,,0..*,uri,"Image, css, script, etc."
ImplementationGuide,Resource.DomainResource.ImplementationGuide, page ,Σ,0..1,BackboneElement,Page/Section in the Guide
ImplementationGuide,Resource.DomainResource.ImplementationGuide.page, source ,Σ,1..1,uri,Where to find that page
ImplementationGuide,Resource.DomainResource.ImplementationGuide.page, title ,Σ,1..1,string,Short title shown for navigational assistance
ImplementationGuide,Resource.DomainResource.ImplementationGuide.page, kind ,Σ,1..1,code,page | example | list | include | directory | dictionary | toc | resourceGuidePageKind (Required)
ImplementationGuide,Resource.DomainResource.ImplementationGuide.page, type ,,0..*,code,Kind of resource to include in the listResourceType (Required)
ImplementationGuide,Resource.DomainResource.ImplementationGuide.page, package ,,0..*,string,Name of package to include
ImplementationGuide,Resource.DomainResource.ImplementationGuide.page, format ,,0..1,code,"Format of the page (e.g. html, markdown, etc.)MimeType  (Required)"
ImplementationGuide,Resource.DomainResource.ImplementationGuide, page ,,0..*,see page,Nested Pages / Sections
Library,Resource.DomainResource.Library, Library ,,,DomainResource,"Represents a library of quality improvement componentsElements defined in Ancestors: id, meta, implicitRules, language, text, contained, extension, modifierExtension"
Library,Resource.DomainResource.Library, url ,Σ,0..1,uri,Logical URI to reference this library (globally unique)
Library,Resource.DomainResource.Library, identifier ,Σ,0..*,Identifier,Additional identifier for the library
Library,Resource.DomainResource.Library, version ,Σ,0..1,string,Business version of the library
Library,Resource.DomainResource.Library, name ,Σ,0..1,string,Name for this library (computer friendly)
Library,Resource.DomainResource.Library, title ,Σ,0..1,string,Name for this library (human friendly)
Library,Resource.DomainResource.Library, status ,?!Σ,1..1,code,draft | active | retired | unknownPublicationStatus (Required)
Library,Resource.DomainResource.Library, experimental ,?!Σ,0..1,boolean,"For testing purposes, not real usage"
Library,Resource.DomainResource.Library, type ,Σ,1..1,CodeableConcept,logic-library | model-definition | asset-collection | module-definitionLibraryType (Extensible)
Library,Resource.DomainResource.Library, date ,Σ,0..1,dateTime,Date this was last changed
Library,Resource.DomainResource.Library, publisher ,Σ,0..1,string,Name of the publisher (organization or individual)
Library,Resource.DomainResource.Library, description ,Σ,0..1,markdown,Natural language description of the library
Library,Resource.DomainResource.Library, purpose ,,0..1,markdown,Why this library is defined
Library,Resource.DomainResource.Library, usage ,,0..1,string,Describes the clinical usage of the library
Library,Resource.DomainResource.Library, approvalDate ,,0..1,date,When the library was approved by publisher
Library,Resource.DomainResource.Library, lastReviewDate ,,0..1,date,When the library was last reviewed
Library,Resource.DomainResource.Library, effectivePeriod ,Σ,0..1,Period,When the library is expected to be used
Library,Resource.DomainResource.Library, useContext ,Σ,0..*,UsageContext,Context the content is intended to support
Library,Resource.DomainResource.Library, jurisdiction ,Σ,0..*,CodeableConcept,Intended jurisdiction for library (if applicable)Jurisdiction ValueSet (Extensible)
Library,Resource.DomainResource.Library, topic ,,0..*,CodeableConcept,"E.g. Education, Treatment, Assessment, etcDefinitionTopic (Example)"
Library,Resource.DomainResource.Library, contributor ,,0..*,Contributor,A content contributor
Library,Resource.DomainResource.Library, contact ,Σ,0..*,ContactDetail,Contact details for the publisher
Library,Resource.DomainResource.Library, copyright ,,0..1,markdown,Use and/or publishing restrictions
Library,Resource.DomainResource.Library, relatedArtifact ,,0..*,RelatedArtifact,"Additional documentation, citations, etc."
Library,Resource.DomainResource.Library, parameter ,,0..*,ParameterDefinition,Parameters defined by the library
Library,Resource.DomainResource.Library, dataRequirement ,,0..*,DataRequirement,What data is referenced by this library
Library,Resource.DomainResource.Library, content ,,0..*,Attachment,"Contents of the library, either embedded or referenced"
Linkage,Resource.DomainResource.Linkage, Linkage ,ΣI,,DomainResource,"Links records for 'same' item+ Must have at least two itemsElements defined in Ancestors: id, meta, implicitRules, language, text, contained, extension, modifierExtension"
Linkage,Resource.DomainResource.Linkage, active ,Σ,0..1,boolean,Whether this linkage assertion is active or not
Linkage,Resource.DomainResource.Linkage, author ,Σ,0..1,Reference(Practitioner | Organization),Who is responsible for linkages
Linkage,Resource.DomainResource.Linkage, item ,ΣI,1..*,BackboneElement,Item to be linked
Linkage,Resource.DomainResource.Linkage.item, type ,Σ,1..1,code,source | alternate | historicalLinkageType (Required)
Linkage,Resource.DomainResource.Linkage.item, resource ,Σ,1..1,Reference(),Resource being linked
List,Resource.DomainResource.List, List ,I,,DomainResource,"Information summarized from a list of other resources+ The deleted flag can only be used if the mode of the list is ""changes""+ A list can only have an emptyReason if it is emptyElements defined in Ancestors: id, meta, implicitRules, language, text, contained, extension, modifierExtension"
List,Resource.DomainResource.List, identifier ,,0..*,Identifier,Business identifier
List,Resource.DomainResource.List, status ,?!Σ,1..1,code,current | retired | entered-in-errorListStatus (Required)
List,Resource.DomainResource.List, mode ,?!Σ,1..1,code,working | snapshot | changesListMode (Required)
List,Resource.DomainResource.List, title ,Σ,0..1,string,Descriptive name for the list
List,Resource.DomainResource.List, code ,Σ,0..1,CodeableConcept,What the purpose of this list isExample Use Codes for List (Example)
List,Resource.DomainResource.List, subject ,Σ,0..1,Reference(Patient | Group | Device | Location),If all resources have the same subject
List,Resource.DomainResource.List, encounter ,,0..1,Reference(Encounter),Context in which list created
List,Resource.DomainResource.List, date ,Σ,0..1,dateTime,When the list was prepared
List,Resource.DomainResource.List, source ,Σ,0..1,Reference(Practitioner | Patient | Device),Who and/or what defined the list contents (aka Author)
List,Resource.DomainResource.List, orderedBy ,,0..1,CodeableConcept,What order the list hasList Order Codes (Preferred)
List,Resource.DomainResource.List, note ,,0..*,Annotation,Comments about the list
List,Resource.DomainResource.List, entry ,I,0..*,BackboneElement,Entries in the list
List,Resource.DomainResource.List.entry, flag ,,0..1,CodeableConcept,Status/Workflow information about this itemPatient Medicine Change Types (Example)
List,Resource.DomainResource.List.entry, deleted ,?!I,0..1,boolean,If this item is actually marked as deleted
List,Resource.DomainResource.List.entry, date ,,0..1,dateTime,When item added to list
List,Resource.DomainResource.List.entry, item ,,1..1,Reference(Any),Actual entry
List,Resource.DomainResource.List, emptyReason ,I,0..1,CodeableConcept,Why list is emptyList Empty Reasons (Preferred)
Location,Resource.DomainResource.Location, Location ,,,DomainResource,"Details and position information for a physical placeElements defined in Ancestors: id, meta, implicitRules, language, text, contained, extension, modifierExtension"
Location,Resource.DomainResource.Location, identifier ,Σ,0..*,Identifier,Unique code or number identifying the location to its users
Location,Resource.DomainResource.Location, status ,?!Σ,0..1,code,active | suspended | inactiveLocationStatus (Required)
Location,Resource.DomainResource.Location, operationalStatus ,Σ,0..1,Coding,The Operational status of the location (typically only for a bed/room)v2 Bed Status (Preferred)
Location,Resource.DomainResource.Location, name ,Σ,0..1,string,Name of the location as used by humans
Location,Resource.DomainResource.Location, alias ,,0..*,string,"A list of alternate names that the location is known as, or was known as in the past"
Location,Resource.DomainResource.Location, description ,Σ,0..1,string,Additional details about the location that could be displayed as further information to identify the location beyond its name
Location,Resource.DomainResource.Location, mode ,?!Σ,0..1,code,instance | kindLocationMode (Required)
Location,Resource.DomainResource.Location, type ,Σ,0..1,CodeableConcept,Type of function performedServiceDeliveryLocationRoleType (Extensible)
Location,Resource.DomainResource.Location, telecom ,,0..*,ContactPoint,Contact details of the location
Location,Resource.DomainResource.Location, address ,,0..1,Address,Physical location
Location,Resource.DomainResource.Location, physicalType ,Σ,0..1,CodeableConcept,Physical form of the locationLocationType (Example)
Location,Resource.DomainResource.Location, position ,,0..1,BackboneElement,The absolute geographic location
Location,Resource.DomainResource.Location.position, longitude ,,1..1,decimal,Longitude with WGS84 datum
Location,Resource.DomainResource.Location.position, latitude ,,1..1,decimal,Latitude with WGS84 datum
Location,Resource.DomainResource.Location.position, altitude ,,0..1,decimal,Altitude with WGS84 datum
Location,Resource.DomainResource.Location, managingOrganization ,Σ,0..1,Reference(Organization),Organization responsible for provisioning and upkeep
Location,Resource.DomainResource.Location, partOf ,,0..1,Reference(Location),Another Location this one is physically part of
Location,Resource.DomainResource.Location, endpoint ,,0..*,Reference(Endpoint),Technical endpoints providing access to services operated for the location
Measure,Resource.DomainResource.Measure, Measure ,,,DomainResource,"A quality measure definitionElements defined in Ancestors: id, meta, implicitRules, language, text, contained, extension, modifierExtension"
Measure,Resource.DomainResource.Measure, url ,Σ,0..1,uri,Logical URI to reference this measure (globally unique)
Measure,Resource.DomainResource.Measure, identifier ,Σ,0..*,Identifier,Additional identifier for the measure
Measure,Resource.DomainResource.Measure, version ,Σ,0..1,string,Business version of the measure
Measure,Resource.DomainResource.Measure, name ,Σ,0..1,string,Name for this measure (computer friendly)
Measure,Resource.DomainResource.Measure, title ,Σ,0..1,string,Name for this measure (human friendly)
Measure,Resource.DomainResource.Measure, status ,?!Σ,1..1,code,draft | active | retired | unknownPublicationStatus (Required)
Measure,Resource.DomainResource.Measure, experimental ,?!Σ,0..1,boolean,"For testing purposes, not real usage"
Measure,Resource.DomainResource.Measure, date ,Σ,0..1,dateTime,Date this was last changed
Measure,Resource.DomainResource.Measure, publisher ,Σ,0..1,string,Name of the publisher (organization or individual)
Measure,Resource.DomainResource.Measure, description ,Σ,0..1,markdown,Natural language description of the measure
Measure,Resource.DomainResource.Measure, purpose ,,0..1,markdown,Why this measure is defined
Measure,Resource.DomainResource.Measure, usage ,,0..1,string,Describes the clinical usage of the measure
Measure,Resource.DomainResource.Measure, approvalDate ,,0..1,date,When the measure was approved by publisher
Measure,Resource.DomainResource.Measure, lastReviewDate ,,0..1,date,When the measure was last reviewed
Measure,Resource.DomainResource.Measure, effectivePeriod ,Σ,0..1,Period,When the measure is expected to be used
Measure,Resource.DomainResource.Measure, useContext ,Σ,0..*,UsageContext,Context the content is intended to support
Measure,Resource.DomainResource.Measure, jurisdiction ,Σ,0..*,CodeableConcept,Intended jurisdiction for measure (if applicable)Jurisdiction ValueSet (Extensible)
Measure,Resource.DomainResource.Measure, topic ,,0..*,CodeableConcept,"E.g. Education, Treatment, Assessment, etcDefinitionTopic (Example)"
Measure,Resource.DomainResource.Measure, contributor ,,0..*,Contributor,A content contributor
Measure,Resource.DomainResource.Measure, contact ,Σ,0..*,ContactDetail,Contact details for the publisher
Measure,Resource.DomainResource.Measure, copyright ,,0..1,markdown,Use and/or publishing restrictions
Measure,Resource.DomainResource.Measure, relatedArtifact ,,0..*,RelatedArtifact,"Additional documentation, citations, etc"
Measure,Resource.DomainResource.Measure, library ,,0..*,Reference(Library),Logic used by the measure
Measure,Resource.DomainResource.Measure, disclaimer ,Σ,0..1,markdown,Disclaimer for use of the measure or its referenced content
Measure,Resource.DomainResource.Measure, scoring ,Σ,0..1,CodeableConcept,proportion | ratio | continuous-variable | cohortMeasureScoring (Extensible)
Measure,Resource.DomainResource.Measure, compositeScoring ,Σ,0..1,CodeableConcept,opportunity | all-or-nothing | linear | weightedCompositeMeasureScoring (Extensible)
Measure,Resource.DomainResource.Measure, type ,Σ,0..*,CodeableConcept,process | outcome | structure | patient-reported-outcome | compositeMeasureType (Extensible)
Measure,Resource.DomainResource.Measure, riskAdjustment ,Σ,0..1,string,How is risk adjustment applied for this measure
Measure,Resource.DomainResource.Measure, rateAggregation ,Σ,0..1,string,How is rate aggregation performed for this measure
Measure,Resource.DomainResource.Measure, rationale ,Σ,0..1,markdown,Why does this measure exist
Measure,Resource.DomainResource.Measure, clinicalRecommendationStatement ,Σ,0..1,markdown,Summary of clinical guidelines
Measure,Resource.DomainResource.Measure, improvementNotation ,Σ,0..1,string,"Improvement notation for the measure, e.g. higher score indicates better quality"
Measure,Resource.DomainResource.Measure, definition ,Σ,0..*,markdown,Defined terms used in the measure documentation
Measure,Resource.DomainResource.Measure, guidance ,Σ,0..1,markdown,Additional guidance for implementers
Measure,Resource.DomainResource.Measure, set ,Σ,0..1,string,"The measure set, e.g. Preventive Care and Screening"
Measure,Resource.DomainResource.Measure, group ,,0..*,BackboneElement,Population criteria group
Measure,Resource.DomainResource.Measure.group, identifier ,,1..1,Identifier,Unique identifier
Measure,Resource.DomainResource.Measure.group, name ,,0..1,string,Short name
Measure,Resource.DomainResource.Measure.group, description ,,0..1,string,Summary description
Measure,Resource.DomainResource.Measure.group, population ,,0..*,BackboneElement,Population criteria
Measure,Resource.DomainResource.Measure.group.population, identifier ,,0..1,Identifier,Unique identifier
Measure,Resource.DomainResource.Measure.group.population, code ,,0..1,CodeableConcept,initial-population | numerator | numerator-exclusion | denominator | denominator-exclusion | denominator-exception | measure-population | measure-population-exclusion | measure-observationMeasurePopulationType (Extensible)
Measure,Resource.DomainResource.Measure.group.population, name ,,0..1,string,Short name
Measure,Resource.DomainResource.Measure.group.population, description ,,0..1,string,The human readable description of this population criteria
Measure,Resource.DomainResource.Measure.group.population, criteria ,,1..1,string,The name of a valid referenced CQL expression (may be namespaced) that defines this population criteria
Measure,Resource.DomainResource.Measure.group, stratifier ,,0..*,BackboneElement,Stratifier criteria for the measure
Measure,Resource.DomainResource.Measure.group.stratifier, identifier ,,0..1,Identifier,The identifier for the stratifier used to coordinate the reported data back to this stratifier
Measure,Resource.DomainResource.Measure.group.stratifier, criteria ,,0..1,string,How the measure should be stratified
Measure,Resource.DomainResource.Measure.group.stratifier, path ,,0..1,string,Path to the stratifier
Measure,Resource.DomainResource.Measure, supplementalData ,,0..*,BackboneElement,What other data should be reported with the measure
Measure,Resource.DomainResource.Measure.supplementalData, identifier ,,0..1,Identifier,"Identifier, unique within the measure"
Measure,Resource.DomainResource.Measure.supplementalData, usage ,,0..*,CodeableConcept,supplemental-data | risk-adjustment-factorMeasureDataUsage (Extensible)
Measure,Resource.DomainResource.Measure.supplementalData, criteria ,,0..1,string,Expression describing additional data to be reported
Measure,Resource.DomainResource.Measure.supplementalData, path ,,0..1,string,Path to the supplemental data element
MeasureReport,Resource.DomainResource.MeasureReport, MeasureReport ,,,DomainResource,"Results of a measure evaluationElements defined in Ancestors: id, meta, implicitRules, language, text, contained, extension, modifierExtension"
MeasureReport,Resource.DomainResource.MeasureReport, identifier ,Σ,0..1,Identifier,Additional identifier for the Report
MeasureReport,Resource.DomainResource.MeasureReport, status ,?!Σ,1..1,code,complete | pending | errorMeasureReportStatus (Required)
MeasureReport,Resource.DomainResource.MeasureReport, type ,Σ,1..1,code,individual | patient-list | summaryMeasureReportType (Required)
MeasureReport,Resource.DomainResource.MeasureReport, measure ,Σ,1..1,Reference(Measure),What measure was evaluated
MeasureReport,Resource.DomainResource.MeasureReport, patient ,Σ,0..1,Reference(Patient),What patient the report is for
MeasureReport,Resource.DomainResource.MeasureReport, date ,Σ,0..1,dateTime,When the report was generated
MeasureReport,Resource.DomainResource.MeasureReport, reportingOrganization ,Σ,0..1,Reference(Organization),Who is reporting the data
MeasureReport,Resource.DomainResource.MeasureReport, period ,Σ,1..1,Period,What period the report covers
MeasureReport,Resource.DomainResource.MeasureReport, group ,,0..*,BackboneElement,Measure results for each group
MeasureReport,Resource.DomainResource.MeasureReport.group, identifier ,,1..1,Identifier,What group of the measure
MeasureReport,Resource.DomainResource.MeasureReport.group, population ,,0..*,BackboneElement,The populations in the group
MeasureReport,Resource.DomainResource.MeasureReport.group.population, identifier ,Σ,0..1,Identifier,Population identifier as defined in the measure
MeasureReport,Resource.DomainResource.MeasureReport.group.population, code ,Σ,0..1,CodeableConcept,initial-population | numerator | numerator-exclusion | denominator | denominator-exclusion | denominator-exception | measure-population | measure-population-exclusion | measure-scoreMeasurePopulationType (Extensible)
MeasureReport,Resource.DomainResource.MeasureReport.group.population, count ,,0..1,integer,Size of the population
MeasureReport,Resource.DomainResource.MeasureReport.group.population, patients ,,0..1,Reference(List),"For patient-list reports, the patients in this population"
MeasureReport,Resource.DomainResource.MeasureReport.group, measureScore ,Σ,0..1,decimal,What score this group achieved
MeasureReport,Resource.DomainResource.MeasureReport.group, stratifier ,,0..*,BackboneElement,Stratification results
MeasureReport,Resource.DomainResource.MeasureReport.group.stratifier, identifier ,,0..1,Identifier,What stratifier of the group
MeasureReport,Resource.DomainResource.MeasureReport.group.stratifier, stratum ,,0..*,BackboneElement,"Stratum results, one for each unique value in the stratifier"
MeasureReport,Resource.DomainResource.MeasureReport.group.stratifier.stratum, value ,,1..1,string,"The stratum value, e.g. male"
MeasureReport,Resource.DomainResource.MeasureReport.group.stratifier.stratum, population ,,0..*,BackboneElement,Population results in this stratum
MeasureReport,Resource.DomainResource.MeasureReport.group.stratifier.stratum.population, identifier ,Σ,0..1,Identifier,Population identifier as defined in the measure
