Resource,Nesting,Resource Content Name,Flags,Cardinality,Datatype,Description
Contract,Resource.DomainResource.Contract, signer ,,0..*,BackboneElement,Contract Signatory
Contract,Resource.DomainResource.Contract.signer, type ,,1..1,Coding,Contract Signatory RoleContract Signer Type Codes (Preferred)
Contract,Resource.DomainResource.Contract.signer, party ,,1..1,Reference(Organization | Patient | Practitioner | RelatedPerson),Contract Signatory Party
Contract,Resource.DomainResource.Contract.signer, signature ,,1..*,Signature,Contract Documentation Signature
Contract,Resource.DomainResource.Contract, valuedItem ,,0..*,BackboneElement,Contract Valued Item List
Contract,Resource.DomainResource.Contract.valuedItem, entity[x] ,,0..1,,Contract Valued Item Type
Contract,Contract.valuedItem.entity[x], entityCodeableConcept,,,CodeableConcept,
Contract,Contract.valuedItem.entity[x], entityReference,,,Reference(Any),
Contract,Resource.DomainResource.Contract.valuedItem, identifier ,,0..1,Identifier,Contract Valued Item Number
Contract,Resource.DomainResource.Contract.valuedItem, effectiveTime ,,0..1,dateTime,Contract Valued Item Effective Tiem
Contract,Resource.DomainResource.Contract.valuedItem, quantity ,,0..1,SimpleQuantity,Count of Contract Valued Items
Contract,Resource.DomainResource.Contract.valuedItem, unitPrice ,,0..1,Money,"Contract Valued Item fee, charge, or cost"
Contract,Resource.DomainResource.Contract.valuedItem, factor ,,0..1,decimal,Contract Valued Item Price Scaling Factor
Contract,Resource.DomainResource.Contract.valuedItem, points ,,0..1,decimal,Contract Valued Item Difficulty Scaling Factor
Contract,Resource.DomainResource.Contract.valuedItem, net ,,0..1,Money,Total Contract Valued Item Value
Contract,Resource.DomainResource.Contract, term ,,0..*,BackboneElement,Contract Term List
Contract,Resource.DomainResource.Contract.term, identifier ,Σ,0..1,Identifier,Contract Term Number
Contract,Resource.DomainResource.Contract.term, issued ,Σ,0..1,dateTime,Contract Term Issue Date Time
Contract,Resource.DomainResource.Contract.term, applies ,Σ,0..1,Period,Contract Term Effective Time
Contract,Resource.DomainResource.Contract.term, type ,,0..1,CodeableConcept,Contract Term Type or FormContract Term Type Codes (Example)
Contract,Resource.DomainResource.Contract.term, subType ,,0..1,CodeableConcept,Contract Term Type specific classificationContract Term Subtype Codes (Example)
Contract,Resource.DomainResource.Contract.term, topic ,Σ,0..*,Reference(Any),Context of the Contract term
Contract,Resource.DomainResource.Contract.term, action ,,0..*,CodeableConcept,Contract Term ActivityContract Action Codes (Example)
Contract,Resource.DomainResource.Contract.term, actionReason ,,0..*,CodeableConcept,Purpose for the Contract Term ActionPurposeOfUse (Example)
Contract,Resource.DomainResource.Contract.term, securityLabel ,Σ,0..*,Coding,Security Labels that define affected termsAll Security Labels (Extensible)
Contract,Resource.DomainResource.Contract.term, agent ,,0..*,BackboneElement,Contract Term Agent List
Contract,Resource.DomainResource.Contract.term.agent, actor ,,1..1,Reference(Contract | Device | Group | Location | Organization | Patient | Practitioner | RelatedPerson | Substance),Contract Term Agent Subject
Contract,Resource.DomainResource.Contract.term.agent, role ,,0..*,CodeableConcept,Type of the Contract Term AgentContract Actor Role Codes (Example)
Contract,Resource.DomainResource.Contract.term, text ,,0..1,string,Human readable Contract term text
Contract,Resource.DomainResource.Contract.term, valuedItem ,,0..*,BackboneElement,Contract Term Valued Item List
Contract,Resource.DomainResource.Contract.term.valuedItem, entity[x] ,,0..1,,Contract Term Valued Item Type
Contract,Contract.term.valuedItem.entity[x], entityCodeableConcept,,,CodeableConcept,
Contract,Contract.term.valuedItem.entity[x], entityReference,,,Reference(Any),
Contract,Resource.DomainResource.Contract.term.valuedItem, identifier ,,0..1,Identifier,Contract Term Valued Item Number
Contract,Resource.DomainResource.Contract.term.valuedItem, effectiveTime ,,0..1,dateTime,Contract Term Valued Item Effective Tiem
Contract,Resource.DomainResource.Contract.term.valuedItem, quantity ,,0..1,SimpleQuantity,Contract Term Valued Item Count
Contract,Resource.DomainResource.Contract.term.valuedItem, unitPrice ,,0..1,Money,"Contract Term Valued Item fee, charge, or cost"
Contract,Resource.DomainResource.Contract.term.valuedItem, factor ,,0..1,decimal,Contract Term Valued Item Price Scaling Factor
Contract,Resource.DomainResource.Contract.term.valuedItem, points ,,0..1,decimal,Contract Term Valued Item Difficulty Scaling Factor
Contract,Resource.DomainResource.Contract.term.valuedItem, net ,,0..1,Money,Total Contract Term Valued Item Value
Contract,Resource.DomainResource.Contract.term, group ,,0..*,see term,Nested Contract Term Group
Contract,Resource.DomainResource.Contract, binding[x] ,,0..1,,Binding Contract
Contract,Contract.binding[x], bindingAttachment,,,Attachment,
Contract,Contract.binding[x], bindingReference,,,Reference(Composition | DocumentReference | QuestionnaireResponse),
Contract,Resource.DomainResource.Contract, friendly ,,0..*,BackboneElement,Contract Friendly Language
Contract,Resource.DomainResource.Contract.friendly, content[x] ,,1..1,,Easily comprehended representation of this Contract
Contract,Contract.friendly.content[x], contentAttachment,,,Attachment,
Contract,Contract.friendly.content[x], contentReference,,,Reference(Composition | DocumentReference | QuestionnaireResponse),
Contract,Resource.DomainResource.Contract, legal ,,0..*,BackboneElement,Contract Legal Language
Contract,Resource.DomainResource.Contract.legal, content[x] ,,1..1,,Contract Legal Text
Contract,Contract.legal.content[x], contentAttachment,,,Attachment,
Contract,Contract.legal.content[x], contentReference,,,Reference(Composition | DocumentReference | QuestionnaireResponse),
Contract,Resource.DomainResource.Contract, rule ,,0..*,BackboneElement,Computable Contract Language
Contract,Resource.DomainResource.Contract.rule, content[x] ,,1..1,,Computable Contract Rules
Contract,Contract.rule.content[x], contentAttachment,,,Attachment,
Contract,Contract.rule.content[x], contentReference,,,Reference(DocumentReference),
Coverage,Resource.DomainResource.Coverage, Coverage ,,,DomainResource,"Insurance or medical plan or a payment agreementElements defined in Ancestors: id, meta, implicitRules, language, text, contained, extension, modifierExtension"
Coverage,Resource.DomainResource.Coverage, identifier ,Σ,0..*,Identifier,The primary coverage ID
Coverage,Resource.DomainResource.Coverage, status ,?!Σ,0..1,code,active | cancelled | draft | entered-in-errorFinancial Resource Status Codes (Required)
Coverage,Resource.DomainResource.Coverage, type ,Σ,0..1,CodeableConcept,Type of coverage such as medical or accidentCoverage Type and Self-Pay Codes (Preferred)
Coverage,Resource.DomainResource.Coverage, policyHolder ,Σ,0..1,Reference(Patient | RelatedPerson | Organization),Owner of the policy
Coverage,Resource.DomainResource.Coverage, subscriber ,Σ,0..1,Reference(Patient | RelatedPerson),Subscriber to the policy
Coverage,Resource.DomainResource.Coverage, subscriberId ,Σ,0..1,string,ID assigned to the Subscriber
Coverage,Resource.DomainResource.Coverage, beneficiary ,Σ,0..1,Reference(Patient),Plan Beneficiary
Coverage,Resource.DomainResource.Coverage, relationship ,,0..1,CodeableConcept,Beneficiary relationship to the SubscriberPolicyholder Relationship Codes (Example)
Coverage,Resource.DomainResource.Coverage, period ,Σ,0..1,Period,Coverage start and end dates
Coverage,Resource.DomainResource.Coverage, payor ,Σ,0..*,Reference(Organization | Patient | RelatedPerson),Identifier for the plan or agreement issuer
Coverage,Resource.DomainResource.Coverage, grouping ,,0..1,BackboneElement,Additional coverage classifications
Coverage,Resource.DomainResource.Coverage, group ,Σ,0..1,string,An identifier for the group
Coverage,Resource.DomainResource.Coverage.grouping, groupDisplay ,Σ,0..1,string,Display text for an identifier for the group
Coverage,Resource.DomainResource.Coverage.grouping, subGroup ,Σ,0..1,string,An identifier for the subsection of the group
Coverage,Resource.DomainResource.Coverage.grouping, subGroupDisplay ,Σ,0..1,string,Display text for the subsection of the group
Coverage,Resource.DomainResource.Coverage.grouping, plan ,Σ,0..1,string,An identifier for the plan
Coverage,Resource.DomainResource.Coverage.grouping, planDisplay ,Σ,0..1,string,Display text for the plan
Coverage,Resource.DomainResource.Coverage.grouping, subPlan ,Σ,0..1,string,An identifier for the subsection of the plan
Coverage,Resource.DomainResource.Coverage.grouping, subPlanDisplay ,Σ,0..1,string,Display text for the subsection of the plan
Coverage,Resource.DomainResource.Coverage.grouping, class ,Σ,0..1,string,An identifier for the class
Coverage,Resource.DomainResource.Coverage.grouping, classDisplay ,Σ,0..1,string,Display text for the class
Coverage,Resource.DomainResource.Coverage.grouping, subClass ,Σ,0..1,string,An identifier for the subsection of the class
Coverage,Resource.DomainResource.Coverage.grouping, subClassDisplay ,Σ,0..1,string,Display text for the subsection of the subclass
Coverage,Resource.DomainResource.Coverage, dependent ,Σ,0..1,string,Dependent number
Coverage,Resource.DomainResource.Coverage, sequence ,Σ,0..1,string,The plan instance or sequence counter
Coverage,Resource.DomainResource.Coverage, order ,Σ,0..1,positiveInt,Relative order of the coverage
Coverage,Resource.DomainResource.Coverage, network ,Σ,0..1,string,Insurer network
Coverage,Resource.DomainResource.Coverage, contract ,,0..*,Reference(Contract),Contract details
DataElement,Resource.DomainResource.DataElement, DataElement ,,,DomainResource,"Resource data elementElements defined in Ancestors: id, meta, implicitRules, language, text, contained, extension, modifierExtension"
DataElement,Resource.DomainResource.DataElement, url ,Σ,0..1,uri,Logical URI to reference this data element (globally unique)
DataElement,Resource.DomainResource.DataElement, identifier ,Σ,0..*,Identifier,Additional identifier for the data element
DataElement,Resource.DomainResource.DataElement, version ,Σ,0..1,string,Business version of the data element
DataElement,Resource.DomainResource.DataElement, status ,?!Σ,1..1,code,draft | active | retired | unknownPublicationStatus (Required)
DataElement,Resource.DomainResource.DataElement, experimental ,?!Σ,0..1,boolean,"For testing purposes, not real usage"
DataElement,Resource.DomainResource.DataElement, date ,Σ,0..1,dateTime,Date this was last changed
DataElement,Resource.DomainResource.DataElement, publisher ,Σ,0..1,string,Name of the publisher (organization or individual)
DataElement,Resource.DomainResource.DataElement, name ,Σ,0..1,string,Name for this data element (computer friendly)
DataElement,Resource.DomainResource.DataElement, title ,Σ,0..1,string,Name for this data element (human friendly)
DataElement,Resource.DomainResource.DataElement, contact ,Σ,0..*,ContactDetail,Contact details for the publisher
DataElement,Resource.DomainResource.DataElement, useContext ,Σ,0..*,UsageContext,Context the content is intended to support
DataElement,Resource.DomainResource.DataElement, jurisdiction ,Σ,0..*,CodeableConcept,Intended jurisdiction for data element (if applicable)Jurisdiction ValueSet (Extensible)
DataElement,Resource.DomainResource.DataElement, copyright ,,0..1,markdown,Use and/or publishing restrictions
DataElement,Resource.DomainResource.DataElement, stringency ,Σ,0..1,code,comparable | fully-specified | equivalent | convertable | scaleable | flexibleDataElementStringency (Required)
DataElement,Resource.DomainResource.DataElement, mapping ,I,0..*,BackboneElement,External specification mapped to+ At least one of  name or uri SHALL be present
DataElement,Resource.DomainResource.DataElement.mapping, identity ,,1..1,id,Internal id when this mapping is used
DataElement,Resource.DomainResource.DataElement.mapping, uri ,,0..1,uri,Identifies what this mapping refers to
DataElement,Resource.DomainResource.DataElement.mapping, name ,,0..1,string,Names what this mapping refers to
DataElement,Resource.DomainResource.DataElement.mapping, comment ,,0..1,string,"Versions, issues, scope limitations, etc."
DataElement,Resource.DomainResource.DataElement, element ,ΣI,1..*,ElementDefinition,Definition of element+ No base allowed+ No slicing allowed
DetectedIssue,Resource.DomainResource.DetectedIssue, DetectedIssue ,,,DomainResource,"Clinical issue with actionElements defined in Ancestors: id, meta, implicitRules, language, text, contained, extension, modifierExtension"
DetectedIssue,Resource.DomainResource.DetectedIssue, identifier ,Σ,0..1,Identifier,Unique id for the detected issue
DetectedIssue,Resource.DomainResource.DetectedIssue, status ,?!Σ,1..1,code,registered | preliminary | final | amended +ObservationStatus (Required)
DetectedIssue,Resource.DomainResource.DetectedIssue, category ,Σ,0..1,CodeableConcept,"Issue Category, e.g. drug-drug, duplicate therapy, etc.Detected Issue Category (Preferred)"
DetectedIssue,Resource.DomainResource.DetectedIssue, severity ,Σ,0..1,code,high | moderate | lowDetectedIssueSeverity (Required)
DetectedIssue,Resource.DomainResource.DetectedIssue, patient ,Σ,0..1,Reference(Patient),Associated patient
DetectedIssue,Resource.DomainResource.DetectedIssue, date ,Σ,0..1,dateTime,When identified
DetectedIssue,Resource.DomainResource.DetectedIssue, author ,Σ,0..1,Reference(Practitioner | Device),The provider or device that identified the issue
DetectedIssue,Resource.DomainResource.DetectedIssue, implicated ,Σ,0..*,Reference(Any),Problem resource
DetectedIssue,Resource.DomainResource.DetectedIssue, detail ,,0..1,string,Description and context
DetectedIssue,Resource.DomainResource.DetectedIssue, reference ,,0..1,uri,Authority for issue
DetectedIssue,Resource.DomainResource.DetectedIssue, mitigation ,,0..*,BackboneElement,Step taken to address
DetectedIssue,Resource.DomainResource.DetectedIssue.mitigation, action ,,1..1,CodeableConcept,What mitigation?Detected Issue Mitigation Action (Preferred)
DetectedIssue,Resource.DomainResource.DetectedIssue.mitigation, date ,,0..1,dateTime,Date committed
DetectedIssue,Resource.DomainResource.DetectedIssue.mitigation, author ,,0..1,Reference(Practitioner),Who is committing?
Device,Resource.DomainResource.Device, Device ,,,DomainResource,"Item used in healthcareElements defined in Ancestors: id, meta, implicitRules, language, text, contained, extension, modifierExtension"
Device,Resource.DomainResource.Device, identifier ,,0..*,Identifier,Instance identifier
Device,Resource.DomainResource.Device, udi ,Σ,0..1,BackboneElement,Unique Device Identifier (UDI) Barcode string
Device,Resource.DomainResource.Device.udi, deviceIdentifier ,Σ,0..1,string,Mandatory fixed portion of UDI
Device,Resource.DomainResource.Device.udi, name ,Σ,0..1,string,Device Name as appears on UDI label
Device,Resource.DomainResource.Device.udi, jurisdiction ,,0..1,uri,Regional UDI authority
Device,Resource.DomainResource.Device.udi, carrierHRF ,Σ,0..1,string,UDI Human Readable Barcode String
Device,Resource.DomainResource.Device.udi, carrierAIDC ,Σ,0..1,base64Binary,UDI Machine Readable Barcode String
Device,Resource.DomainResource.Device.udi, issuer ,,0..1,uri,UDI Issuing Organization
Device,Resource.DomainResource.Device.udi, entryType ,,0..1,code,barcode | rfid | manual +UDIEntryType (Required)
Device,Resource.DomainResource.Device, status ,?!Σ,0..1,code,active | inactive | entered-in-error | unknownFHIRDeviceStatus (Required)
Device,Resource.DomainResource.Device, type ,,0..1,CodeableConcept,What kind of device this isFHIR Device Types (Example)
Device,Resource.DomainResource.Device, lotNumber ,,0..1,string,Lot number of manufacture
Device,Resource.DomainResource.Device, manufacturer ,,0..1,string,Name of device manufacturer
Device,Resource.DomainResource.Device, manufactureDate ,,0..1,dateTime,Date when the device was made
Device,Resource.DomainResource.Device, expirationDate ,,0..1,dateTime,Date and time of expiry of this device (if applicable)
Device,Resource.DomainResource.Device, model ,,0..1,string,Model id assigned by the manufacturer
Device,Resource.DomainResource.Device, version ,,0..1,string,Version number (i.e. software)
Device,Resource.DomainResource.Device, patient ,,0..1,Reference(Patient),Patient to whom Device is affixed
Device,Resource.DomainResource.Device, owner ,,0..1,Reference(Organization),Organization responsible for device
Device,Resource.DomainResource.Device, contact ,,0..*,ContactPoint,Details for human/organization for support
Device,Resource.DomainResource.Device, location ,,0..1,Reference(Location),Where the resource is found
Device,Resource.DomainResource.Device, url ,,0..1,uri,Network address to contact device
Device,Resource.DomainResource.Device, note ,,0..*,Annotation,Device notes and comments
Device,Resource.DomainResource.Device, safety ,Σ,0..*,CodeableConcept,Safety Characteristics of DeviceDeviceSafety (Example)
DeviceComponent,Resource.DomainResource.DeviceComponent, DeviceComponent ,Σ,,DomainResource,"An instance of a medical-related component of a medical deviceElements defined in Ancestors: id, meta, implicitRules, language, text, contained, extension, modifierExtension"
DeviceComponent,Resource.DomainResource.DeviceComponent, identifier ,Σ,1..1,Identifier,Instance id assigned by the software stack
DeviceComponent,Resource.DomainResource.DeviceComponent, type ,Σ,1..1,CodeableConcept,What kind of component it isFHIR Device Types (Preferred)
DeviceComponent,Resource.DomainResource.DeviceComponent, lastSystemChange ,Σ,0..1,instant,Recent system change timestamp
DeviceComponent,Resource.DomainResource.DeviceComponent, source ,Σ,0..1,Reference(Device),Top-level device resource link
DeviceComponent,Resource.DomainResource.DeviceComponent, parent ,Σ,0..1,Reference(DeviceComponent),Parent resource link
DeviceComponent,Resource.DomainResource.DeviceComponent, operationalStatus ,Σ,0..*,CodeableConcept,"Current operational status of the component, for example On, Off or StandbyDeviceComponentOperationalStatus (Extensible)"
DeviceComponent,Resource.DomainResource.DeviceComponent, parameterGroup ,Σ,0..1,CodeableConcept,Current supported parameter groupDeviceComponentParameterGroup (Extensible)
DeviceComponent,Resource.DomainResource.DeviceComponent, measurementPrinciple ,Σ,0..1,code,other | chemical | electrical | impedance | nuclear | optical | thermal | biological | mechanical | acoustical | manual+MeasmntPrinciple (Required)
DeviceComponent,Resource.DomainResource.DeviceComponent, productionSpecification ,Σ,0..*,BackboneElement,"Specification details such as Component Revisions, or Serial Numbers"
DeviceComponent,Resource.DomainResource.DeviceComponent.productionSpecification, specType ,Σ,0..1,CodeableConcept,"Type or kind of production specification, for example serial number or software revisionDeviceSpecificationSpecType (Extensible)"
DeviceComponent,Resource.DomainResource.DeviceComponent.productionSpecification, componentId ,Σ,0..1,Identifier,Internal component unique identification
DeviceComponent,Resource.DomainResource.DeviceComponent, productionSpec ,Σ,0..1,string,A printable string defining the component
DeviceComponent,Resource.DomainResource.DeviceComponent, languageCode ,Σ,0..1,CodeableConcept,Language code for the human-readable text strings produced by the deviceCommon Languages (Extensible but limited to All Languages)
DeviceMetric,Resource.DomainResource.DeviceMetric, DeviceMetric ,Σ,,DomainResource,"Measurement, calculation or setting capability of a medical deviceElements defined in Ancestors: id, meta, implicitRules, language, text, contained, extension, modifierExtension"
DeviceMetric,Resource.DomainResource.DeviceMetric, identifier ,Σ,1..1,Identifier,Unique identifier of this DeviceMetric
DeviceMetric,Resource.DomainResource.DeviceMetric, type ,Σ,1..1,CodeableConcept,"Identity of metric, for example Heart Rate or PEEP SettingDevice Metric and Component Types (Preferred)"
DeviceMetric,Resource.DomainResource.DeviceMetric, unit ,Σ,0..1,CodeableConcept,Unit of Measure for the MetricDevice Metric and Component Types (Preferred)
DeviceMetric,Resource.DomainResource.DeviceMetric, source ,Σ,0..1,Reference(Device),Describes the link to the source Device
DeviceMetric,Resource.DomainResource.DeviceMetric, parent ,Σ,0..1,Reference(DeviceComponent),Describes the link to the parent DeviceComponent
DeviceMetric,Resource.DomainResource.DeviceMetric, operationalStatus ,Σ,0..1,code,on | off | standby | entered-in-errorDeviceMetricOperationalStatus (Required)
DeviceMetric,Resource.DomainResource.DeviceMetric, color ,Σ,0..1,code,black | red | green | yellow | blue | magenta | cyan | whiteDeviceMetricColor (Required)
DeviceMetric,Resource.DomainResource.DeviceMetric, category ,Σ,1..1,code,measurement | setting | calculation | unspecifiedDeviceMetricCategory (Required)
DeviceMetric,Resource.DomainResource.DeviceMetric, measurementPeriod ,Σ,0..1,Timing,Describes the measurement repetition time
DeviceMetric,Resource.DomainResource.DeviceMetric, calibration ,Σ,0..*,BackboneElement,Describes the calibrations that have been performed or that are required to be performed
DeviceMetric,Resource.DomainResource.DeviceMetric.calibration, type ,Σ,0..1,code,unspecified | offset | gain | two-pointDeviceMetricCalibrationType (Required)
DeviceMetric,Resource.DomainResource.DeviceMetric.calibration, state ,Σ,0..1,code,not-calibrated | calibration-required | calibrated | unspecifiedDeviceMetricCalibrationState (Required)
DeviceMetric,Resource.DomainResource.DeviceMetric.calibration, time ,Σ,0..1,instant,Describes the time last calibration has been performed
DeviceRequest,Resource.DomainResource.DeviceRequest, DeviceRequest ,,,DomainResource,"Medical device requestElements defined in Ancestors: id, meta, implicitRules, language, text, contained, extension, modifierExtension"
DeviceRequest,Resource.DomainResource.DeviceRequest, identifier ,Σ,0..*,Identifier,External Request identifier
DeviceRequest,Resource.DomainResource.DeviceRequest, definition ,Σ,0..*,Reference(ActivityDefinition | PlanDefinition),Protocol or definition
DeviceRequest,Resource.DomainResource.DeviceRequest, basedOn ,Σ,0..*,Reference(Any),What request fulfills
DeviceRequest,Resource.DomainResource.DeviceRequest, priorRequest ,Σ,0..*,Reference(Any),What request replaces
DeviceRequest,Resource.DomainResource.DeviceRequest, groupIdentifier ,Σ,0..1,Identifier,Identifier of composite request
DeviceRequest,Resource.DomainResource.DeviceRequest, status ,?!Σ,0..1,code,draft | active | suspended | completed | entered-in-error | cancelledRequestStatus (Required)
DeviceRequest,Resource.DomainResource.DeviceRequest, intent ,?!Σ,1..1,CodeableConcept,proposal | plan | original-order | encoded | reflex-orderRequestIntent  (Required)
DeviceRequest,Resource.DomainResource.DeviceRequest, priority ,Σ,0..1,code,Indicates how quickly the {{title}} should be addressed with respect to other requestsRequestPriority (Required)
DeviceRequest,Resource.DomainResource.DeviceRequest, code[x] ,Σ,1..1,,Device requestedFHIR Device Types (Example)
DeviceRequest,DeviceRequest.code[x], codeReference,,,Reference(Device),
DeviceRequest,DeviceRequest.code[x], codeCodeableConcept,,,CodeableConcept,
DeviceRequest,Resource.DomainResource.DeviceRequest, subject ,Σ,1..1,Reference(Patient | Group | Location | Device),Focus of request
DeviceRequest,Resource.DomainResource.DeviceRequest, context ,Σ,0..1,Reference(Encounter | EpisodeOfCare),Encounter or Episode motivating request
DeviceRequest,Resource.DomainResource.DeviceRequest, occurrence[x] ,Σ,0..1,,Desired time or schedule for use
DeviceRequest,DeviceRequest.occurrence[x], occurrenceDateTime,,,dateTime,
DeviceRequest,DeviceRequest.occurrence[x], occurrencePeriod,,,Period,
DeviceRequest,DeviceRequest.occurrence[x], occurrenceTiming,,,Timing,
DeviceRequest,Resource.DomainResource.DeviceRequest, authoredOn ,Σ,0..1,dateTime,When recorded
DeviceRequest,Resource.DomainResource.DeviceRequest, requester ,Σ,0..1,BackboneElement,Who/what is requesting diagnostics
DeviceRequest,Resource.DomainResource.DeviceRequest.requester, agent ,Σ,1..1,Reference(Device | Practitioner | Organization),Individual making the request
DeviceRequest,Resource.DomainResource.DeviceRequest.requester, onBehalfOf ,Σ,0..1,Reference(Organization),Organization agent is acting for
DeviceRequest,Resource.DomainResource.DeviceRequest, performerType ,Σ,0..1,CodeableConcept,Fille roleParticipant Roles (Example)
DeviceRequest,Resource.DomainResource.DeviceRequest, performer ,Σ,0..1,Reference(Practitioner | Organization | Patient | Device | RelatedPerson | HealthcareService),Requested Filler
DeviceRequest,Resource.DomainResource.DeviceRequest, reasonCode ,Σ,0..*,CodeableConcept,Coded Reason for requestCondition/Problem/Diagnosis Codes (Example)
DeviceRequest,Resource.DomainResource.DeviceRequest, reasonReference ,Σ,0..*,Reference(Any),Linked Reason for request
DeviceRequest,Resource.DomainResource.DeviceRequest, supportingInfo ,,0..*,Reference(Any),Additional clinical information
DeviceRequest,Resource.DomainResource.DeviceRequest, note ,,0..*,Annotation,Notes or comments
DeviceRequest,Resource.DomainResource.DeviceRequest, relevantHistory ,,0..*,Reference(Provenance),Request provenance
