Resource,Nesting,Resource Content Name,Flags,Cardinality,Datatype,Description
PlanDefinition,Resource.DomainResource.PlanDefinition.action, documentation ,,0..*,RelatedArtifact,Supporting documentation for the intended performer of the action
PlanDefinition,Resource.DomainResource.PlanDefinition.action, goalId ,,0..*,id,What goals this action supports
PlanDefinition,Resource.DomainResource.PlanDefinition.action, triggerDefinition ,,0..*,TriggerDefinition,When the action should be triggered
PlanDefinition,Resource.DomainResource.PlanDefinition.action, condition ,,0..*,BackboneElement,Whether or not the action is applicable
PlanDefinition,Resource.DomainResource.PlanDefinition.action.condition, kind ,,1..1,code,applicability | start | stopActionConditionKind (Required)
PlanDefinition,Resource.DomainResource.PlanDefinition.action.condition, description ,,0..1,string,Natural language description of the condition
PlanDefinition,Resource.DomainResource.PlanDefinition.action.condition, language ,,0..1,string,Language of the expression
PlanDefinition,Resource.DomainResource.PlanDefinition.action.condition, expression ,,0..1,string,Boolean-valued expression
PlanDefinition,Resource.DomainResource.PlanDefinition.action, input ,,0..*,DataRequirement,Input data requirements
PlanDefinition,Resource.DomainResource.PlanDefinition.action, output ,,0..*,DataRequirement,Output data definition
PlanDefinition,Resource.DomainResource.PlanDefinition.action, relatedAction ,,0..*,BackboneElement,Relationship to another action
PlanDefinition,Resource.DomainResource.PlanDefinition.action.relatedAction, actionId ,,1..1,id,What action is this related to
PlanDefinition,Resource.DomainResource.PlanDefinition.action.relatedAction, relationship ,,1..1,code,before-start | before | before-end | concurrent-with-start | concurrent | concurrent-with-end | after-start | after | after-endActionRelationshipType (Required)
PlanDefinition,Resource.DomainResource.PlanDefinition.action.relatedAction, offset[x] ,,0..1,,Time offset for the relationship
PlanDefinition,PlanDefinition.action.relatedAction.offset[x], offsetDuration,,,Duration,
PlanDefinition,PlanDefinition.action.relatedAction.offset[x], offsetRange,,,Range,
PlanDefinition,Resource.DomainResource.PlanDefinition.action, timing[x] ,,0..1,,When the action should take place
PlanDefinition,PlanDefinition.action.timing[x], timingDateTime,,,dateTime,
PlanDefinition,PlanDefinition.action.timing[x], timingPeriod,,,Period,
PlanDefinition,PlanDefinition.action.timing[x], timingDuration,,,Duration,
PlanDefinition,PlanDefinition.action.timing[x], timingRange,,,Range,
PlanDefinition,PlanDefinition.action.timing[x], timingTiming,,,Timing,
PlanDefinition,Resource.DomainResource.PlanDefinition.action, participant ,,0..*,BackboneElement,Who should participate in the action
PlanDefinition,Resource.DomainResource.PlanDefinition.action.participant, type ,,1..1,code,patient | practitioner | related-personActionParticipantType (Required)
PlanDefinition,Resource.DomainResource.PlanDefinition.action.participant, role ,,0..1,CodeableConcept,"E.g. Nurse, Surgeon, Parent, etcActionParticipantRole (Example)"
PlanDefinition,Resource.DomainResource.PlanDefinition.action, type ,,0..1,Coding,create | update | remove | fire-eventActionType (Required)
PlanDefinition,Resource.DomainResource.PlanDefinition.action, groupingBehavior ,,0..1,code,visual-group | logical-group | sentence-groupActionGroupingBehavior (Required)
PlanDefinition,Resource.DomainResource.PlanDefinition.action, selectionBehavior ,,0..1,code,any | all | all-or-none | exactly-one | at-most-one | one-or-moreActionSelectionBehavior (Required)
PlanDefinition,Resource.DomainResource.PlanDefinition.action, requiredBehavior ,,0..1,code,must | could | must-unless-documentedActionRequiredBehavior (Required)
PlanDefinition,Resource.DomainResource.PlanDefinition.action, precheckBehavior ,,0..1,code,yes | noActionPrecheckBehavior (Required)
PlanDefinition,Resource.DomainResource.PlanDefinition.action, cardinalityBehavior ,,0..1,code,single | multipleActionCardinalityBehavior (Required)
PlanDefinition,Resource.DomainResource.PlanDefinition.action, definition ,,0..1,Reference(ActivityDefinition | PlanDefinition),Description of the activity to be performed
PlanDefinition,Resource.DomainResource.PlanDefinition.action, transform ,,0..1,Reference(StructureMap),Transform to apply the template
PlanDefinition,Resource.DomainResource.PlanDefinition.action, dynamicValue ,,0..*,BackboneElement,Dynamic aspects of the definition
PlanDefinition,Resource.DomainResource.PlanDefinition.action.dynamicValue, description ,,0..1,string,Natural language description of the dynamic value
PlanDefinition,Resource.DomainResource.PlanDefinition.action.dynamicValue, path ,,0..1,string,The path to the element to be set dynamically
PlanDefinition,Resource.DomainResource.PlanDefinition.action.dynamicValue, language ,,0..1,string,Language of the expression
PlanDefinition,Resource.DomainResource.PlanDefinition.action.dynamicValue, expression ,,0..1,string,An expression that provides the dynamic value for the customization
PlanDefinition,Resource.DomainResource.PlanDefinition, action ,,0..*,see action,A sub-action
Practitioner,Resource.DomainResource.Practitioner, Practitioner ,,,DomainResource,"A person with a  formal responsibility in the provisioning of healthcare or related servicesElements defined in Ancestors: id, meta, implicitRules, language, text, contained, extension, modifierExtension"
Practitioner,Resource.DomainResource.Practitioner, identifier ,Σ,0..*,Identifier,A identifier for the person as this agent
Practitioner,Resource.DomainResource.Practitioner, active ,Σ,0..1,boolean,Whether this practitioner's record is in active use
Practitioner,Resource.DomainResource.Practitioner, name ,Σ,0..*,HumanName,The name(s) associated with the practitioner
Practitioner,Resource.DomainResource.Practitioner, telecom ,Σ,0..*,ContactPoint,A contact detail for the practitioner (that apply to all roles)
Practitioner,Resource.DomainResource.Practitioner, address ,Σ,0..*,Address,Address(es) of the practitioner that are not role specific (typically home address)
Practitioner,Resource.DomainResource.Practitioner, gender ,Σ,0..1,code,male | female | other | unknownAdministrativeGender (Required)
Practitioner,Resource.DomainResource.Practitioner, birthDate ,Σ,0..1,date,The date  on which the practitioner was born
Practitioner,Resource.DomainResource.Practitioner, photo ,,0..*,Attachment,Image of the person
Practitioner,Resource.DomainResource.Practitioner, qualification ,,0..*,BackboneElement,Qualifications obtained by training and certification
Practitioner,Resource.DomainResource.Practitioner.qualification, identifier ,,0..*,Identifier,An identifier for this qualification for the practitioner
Practitioner,Resource.DomainResource.Practitioner.qualification, code ,,1..1,CodeableConcept,"Coded representation of the qualificationv2 table 0360, Version 2.7 (Example)"
Practitioner,Resource.DomainResource.Practitioner.qualification, period ,,0..1,Period,Period during which the qualification is valid
Practitioner,Resource.DomainResource.Practitioner.qualification, issuer ,,0..1,Reference(Organization),Organization that regulates and issues the qualification
Practitioner,Resource.DomainResource.Practitioner, communication ,,0..*,CodeableConcept,A language the practitioner is able to use in patient communicationCommon Languages (Extensible but limited to All Languages)
PractitionerRole,Resource.DomainResource.PractitionerRole, PractitionerRole ,,,DomainResource,"Roles/organizations the practitioner is associated withElements defined in Ancestors: id, meta, implicitRules, language, text, contained, extension, modifierExtension"
PractitionerRole,Resource.DomainResource.PractitionerRole, identifier ,Σ,0..*,Identifier,Business Identifiers that are specific to a role/location
PractitionerRole,Resource.DomainResource.PractitionerRole, active ,Σ,0..1,boolean,Whether this practitioner's record is in active use
PractitionerRole,Resource.DomainResource.PractitionerRole, period ,Σ,0..1,Period,The period during which the practitioner is authorized to perform in these role(s)
PractitionerRole,Resource.DomainResource.PractitionerRole, practitioner ,Σ,0..1,Reference(Practitioner),Practitioner that is able to provide the defined services for the organation
PractitionerRole,Resource.DomainResource.PractitionerRole, organization ,Σ,0..1,Reference(Organization),Organization where the roles are available
PractitionerRole,Resource.DomainResource.PractitionerRole, code ,Σ,0..*,CodeableConcept,Roles which this practitioner may performPractitionerRole (Example)
PractitionerRole,Resource.DomainResource.PractitionerRole, specialty ,Σ,0..*,CodeableConcept,Specific specialty of the practitionerPractice Setting Code Value Set (Preferred)
PractitionerRole,Resource.DomainResource.PractitionerRole, location ,Σ,0..*,Reference(Location),The location(s) at which this practitioner provides care
PractitionerRole,Resource.DomainResource.PractitionerRole, healthcareService ,,0..*,Reference(HealthcareService),The list of healthcare services that this worker provides for this role's Organization/Location(s)
PractitionerRole,Resource.DomainResource.PractitionerRole, telecom ,Σ,0..*,ContactPoint,Contact details that are specific to the role/location/service
PractitionerRole,Resource.DomainResource.PractitionerRole, availableTime ,,0..*,BackboneElement,Times the Service Site is available
PractitionerRole,Resource.DomainResource.PractitionerRole.availableTime, daysOfWeek ,,0..*,code,mon | tue | wed | thu | fri | sat | sunDaysOfWeek (Required)
PractitionerRole,Resource.DomainResource.PractitionerRole.availableTime, allDay ,,0..1,boolean,Always available? e.g. 24 hour service
PractitionerRole,Resource.DomainResource.PractitionerRole.availableTime, availableStartTime ,,0..1,time,Opening time of day (ignored if allDay = true)
PractitionerRole,Resource.DomainResource.PractitionerRole.availableTime, availableEndTime ,,0..1,time,Closing time of day (ignored if allDay = true)
PractitionerRole,Resource.DomainResource.PractitionerRole, notAvailable ,,0..*,BackboneElement,Not available during this time due to provided reason
PractitionerRole,Resource.DomainResource.PractitionerRole.notAvailable, description ,,1..1,string,Reason presented to the user explaining why time not available
PractitionerRole,Resource.DomainResource.PractitionerRole.notAvailable, during ,,0..1,Period,Service not availablefrom this date
PractitionerRole,Resource.DomainResource.PractitionerRole, availabilityExceptions ,,0..1,string,Description of availability exceptions
PractitionerRole,Resource.DomainResource.PractitionerRole, endpoint ,,0..*,Reference(Endpoint),Technical endpoints providing access to services operated for the practitioner with this role
Procedure,Resource.DomainResource.Procedure, Procedure ,I,,DomainResource,"An action that is being or was performed on a patient+ Reason not done is only permitted if notDone indicator is trueElements defined in Ancestors: id, meta, implicitRules, language, text, contained, extension, modifierExtension"
Procedure,Resource.DomainResource.Procedure, identifier ,Σ,0..*,Identifier,External Identifiers for this procedure
Procedure,Resource.DomainResource.Procedure, definition ,Σ,0..*,Reference(PlanDefinition | ActivityDefinition | HealthcareService),Instantiates protocol or definition
Procedure,Resource.DomainResource.Procedure, basedOn ,Σ,0..*,Reference(CarePlan | ProcedureRequest | ReferralRequest),A request for this procedure
Procedure,Resource.DomainResource.Procedure, partOf ,Σ,0..*,Reference(Procedure | Observation | MedicationAdministration),Part of referenced event
Procedure,Resource.DomainResource.Procedure, status ,?!Σ,1..1,code,preparation | in-progress | suspended | aborted | completed | entered-in-error | unknownEventStatus (Required)
Procedure,Resource.DomainResource.Procedure, notDone ,?!Σ,0..1,boolean,True if procedure was not performed as scheduled
Procedure,Resource.DomainResource.Procedure, notDoneReason ,ΣI,0..1,CodeableConcept,Reason procedure was not performedProcedure Not Performed Reason (SNOMED-CT) (Example)
Procedure,Resource.DomainResource.Procedure, category ,Σ,0..1,CodeableConcept,Classification of the procedureProcedure Category Codes (SNOMED CT) (Example)
Procedure,Resource.DomainResource.Procedure, code ,Σ,0..1,CodeableConcept,Identification of the procedureProcedure Codes (SNOMED CT) (Example)
Procedure,Resource.DomainResource.Procedure, subject ,Σ,1..1,Reference(Patient | Group),Who the procedure was performed on
Procedure,Resource.DomainResource.Procedure, context ,Σ,0..1,Reference(Encounter | EpisodeOfCare),Encounter or episode associated with the procedure
Procedure,Resource.DomainResource.Procedure, performed[x] ,Σ,0..1,,Date/Period the procedure was performed
Procedure,Procedure.performed[x], performedDateTime,,,dateTime,
Procedure,Procedure.performed[x], performedPeriod,,,Period,
Procedure,Resource.DomainResource.Procedure, performer ,Σ,0..*,BackboneElement,The people who performed the procedure
Procedure,Resource.DomainResource.Procedure.performer, role ,Σ,0..1,CodeableConcept,The role the actor was inProcedure Performer Role Codes (Example)
Procedure,Resource.DomainResource.Procedure.performer, actor ,Σ,1..1,Reference(Practitioner | Organization | Patient | RelatedPerson | Device),The reference to the practitioner
Procedure,Resource.DomainResource.Procedure.performer, onBehalfOf ,,0..1,Reference(Organization),Organization the device or practitioner was acting for
Procedure,Resource.DomainResource.Procedure, location ,Σ,0..1,Reference(Location),Where the procedure happened
Procedure,Resource.DomainResource.Procedure, reasonCode ,Σ,0..*,CodeableConcept,Coded reason procedure performedProcedure Reason Codes (Example)
Procedure,Resource.DomainResource.Procedure, reasonReference ,Σ,0..*,Reference(Condition | Observation),Condition that is the reason the procedure performed
Procedure,Resource.DomainResource.Procedure, bodySite ,Σ,0..*,CodeableConcept,Target body sitesSNOMED CT Body Structures (Example)
Procedure,Resource.DomainResource.Procedure, outcome ,Σ,0..1,CodeableConcept,The result of procedureProcedure Outcome Codes (SNOMED CT) (Example)
Procedure,Resource.DomainResource.Procedure, report ,,0..*,Reference(DiagnosticReport),Any report resulting from the procedure
Procedure,Resource.DomainResource.Procedure, complication ,,0..*,CodeableConcept,Complication following the procedureCondition/Problem/Diagnosis Codes (Example)
Procedure,Resource.DomainResource.Procedure, complicationDetail ,,0..*,Reference(Condition),A condition that is a result of the procedure
Procedure,Resource.DomainResource.Procedure, followUp ,,0..*,CodeableConcept,Instructions for follow upProcedure Follow up Codes (SNOMED CT) (Example)
Procedure,Resource.DomainResource.Procedure, note ,,0..*,Annotation,Additional information about the procedure
Procedure,Resource.DomainResource.Procedure, focalDevice ,,0..*,BackboneElement,Device changed in procedure
Procedure,Resource.DomainResource.Procedure.focalDevice, action ,,0..1,CodeableConcept,Kind of change to deviceProcedure Device Action Codes (Preferred)
Procedure,Resource.DomainResource.Procedure.focalDevice, manipulated ,,1..1,Reference(Device),Device that was changed
Procedure,Resource.DomainResource.Procedure, usedReference ,,0..*,Reference(Device | Medication | Substance),Items used during procedure
Procedure,Resource.DomainResource.Procedure, usedCode ,,0..*,CodeableConcept,Coded items used during the procedureFHIR Device Types (Example)
ProcedureRequest,Resource.DomainResource.ProcedureRequest, ProcedureRequest ,,,DomainResource,"A request for a procedure or diagnostic to be performedElements defined in Ancestors: id, meta, implicitRules, language, text, contained, extension, modifierExtension"
ProcedureRequest,Resource.DomainResource.ProcedureRequest, identifier ,Σ,0..*,Identifier,Identifiers assigned to this order
ProcedureRequest,Resource.DomainResource.ProcedureRequest, definition ,Σ,0..*,Reference(ActivityDefinition | PlanDefinition),Protocol or definition
ProcedureRequest,Resource.DomainResource.ProcedureRequest, basedOn ,Σ,0..*,Reference(Any),What request fulfills
ProcedureRequest,Resource.DomainResource.ProcedureRequest, replaces ,Σ,0..*,Reference(Any),What request replaces
ProcedureRequest,Resource.DomainResource.ProcedureRequest, requisition ,Σ,0..1,Identifier,Composite Request ID
ProcedureRequest,Resource.DomainResource.ProcedureRequest, status ,?!Σ,1..1,code,draft | active | suspended | completed | entered-in-error | cancelledRequestStatus (Required)
ProcedureRequest,Resource.DomainResource.ProcedureRequest, intent ,?!Σ,1..1,code,proposal | plan | order +RequestIntent (Required)
ProcedureRequest,Resource.DomainResource.ProcedureRequest, priority ,Σ,0..1,code,routine | urgent | asap | statRequestPriority (Required)
ProcedureRequest,Resource.DomainResource.ProcedureRequest, doNotPerform ,?!Σ,0..1,boolean,True if procedure should not be performed
ProcedureRequest,Resource.DomainResource.ProcedureRequest, category ,Σ,0..*,CodeableConcept,Classification of procedureProcedure Category Codes (SNOMED CT) (Example)
ProcedureRequest,Resource.DomainResource.ProcedureRequest, code ,Σ,1..1,CodeableConcept,What is being requested/orderedProcedure Codes (SNOMED CT) (Example)
ProcedureRequest,Resource.DomainResource.ProcedureRequest, subject ,Σ,1..1,Reference(Patient | Group | Location | Device),Individual the service is ordered for
ProcedureRequest,Resource.DomainResource.ProcedureRequest, context ,Σ,0..1,Reference(Encounter | EpisodeOfCare),Encounter or Episode during which request was created
ProcedureRequest,Resource.DomainResource.ProcedureRequest, occurrence[x] ,Σ,0..1,,When procedure should occur
ProcedureRequest,ProcedureRequest.occurrence[x], occurrenceDateTime,,,dateTime,
ProcedureRequest,ProcedureRequest.occurrence[x], occurrencePeriod,,,Period,
ProcedureRequest,ProcedureRequest.occurrence[x], occurrenceTiming,,,Timing,
ProcedureRequest,Resource.DomainResource.ProcedureRequest, asNeeded[x] ,Σ,0..1,,Preconditions for procedure or diagnosticSNOMED CT Medication As Needed Reason Codes (Example)
ProcedureRequest,ProcedureRequest.asNeeded[x], asNeededBoolean,,,boolean,
ProcedureRequest,ProcedureRequest.asNeeded[x], asNeededCodeableConcept,,,CodeableConcept,
ProcedureRequest,Resource.DomainResource.ProcedureRequest, authoredOn ,Σ,0..1,dateTime,Date request signed
ProcedureRequest,Resource.DomainResource.ProcedureRequest, requester ,Σ,0..1,BackboneElement,Who/what is requesting procedure or diagnostic
ProcedureRequest,Resource.DomainResource.ProcedureRequest.requester, agent ,Σ,1..1,Reference(Device | Practitioner | Organization),Individual making the request
ProcedureRequest,Resource.DomainResource.ProcedureRequest.requester, onBehalfOf ,Σ,0..1,Reference(Organization),Organization agent is acting for
ProcedureRequest,Resource.DomainResource.ProcedureRequest, performerType ,Σ,0..1,CodeableConcept,Performer roleParticipant Roles (Example)
ProcedureRequest,Resource.DomainResource.ProcedureRequest, performer ,Σ,0..1,Reference(Practitioner | Organization | Patient | Device | RelatedPerson | HealthcareService),Requested perfomer
ProcedureRequest,Resource.DomainResource.ProcedureRequest, reasonCode ,Σ,0..*,CodeableConcept,Explanation/Justification for testProcedure Reason Codes (Example)
ProcedureRequest,Resource.DomainResource.ProcedureRequest, reasonReference ,Σ,0..*,Reference(Condition | Observation),Explanation/Justification for test
ProcedureRequest,Resource.DomainResource.ProcedureRequest, supportingInfo ,,0..*,Reference(Any),Additional clinical information
ProcedureRequest,Resource.DomainResource.ProcedureRequest, specimen ,Σ,0..*,Reference(Specimen),Procedure Samples
ProcedureRequest,Resource.DomainResource.ProcedureRequest, bodySite ,Σ,0..*,CodeableConcept,Location on BodySNOMED CT Body Structures (Example)
ProcedureRequest,Resource.DomainResource.ProcedureRequest, note ,,0..*,Annotation,Comments
ProcedureRequest,Resource.DomainResource.ProcedureRequest, relevantHistory ,,0..*,Reference(Provenance),Request provenance
ProcessRequest,Resource.DomainResource.ProcessRequest, ProcessRequest ,,,DomainResource,"Request to perform some action on or in regards to an existing resourceElements defined in Ancestors: id, meta, implicitRules, language, text, contained, extension, modifierExtension"
ProcessRequest,Resource.DomainResource.ProcessRequest, identifier ,,0..*,Identifier,Business Identifier
ProcessRequest,Resource.DomainResource.ProcessRequest, status ,?!Σ,0..1,code,active | cancelled | draft | entered-in-errorFinancial Resource Status Codes (Required)
ProcessRequest,Resource.DomainResource.ProcessRequest, action ,,0..1,code,cancel | poll | reprocess | statusActionList (Required)
ProcessRequest,Resource.DomainResource.ProcessRequest, target ,,0..1,Reference(Organization),Party which is the target of the request
ProcessRequest,Resource.DomainResource.ProcessRequest, created ,,0..1,dateTime,Creation date
ProcessRequest,Resource.DomainResource.ProcessRequest, provider ,,0..1,Reference(Practitioner),Responsible practitioner
ProcessRequest,Resource.DomainResource.ProcessRequest, organization ,,0..1,Reference(Organization),Responsible organization
ProcessRequest,Resource.DomainResource.ProcessRequest, request ,,0..1,Reference(Any),Reference to the Request resource
ProcessRequest,Resource.DomainResource.ProcessRequest, response ,,0..1,Reference(Any),Reference to the Response resource
ProcessRequest,Resource.DomainResource.ProcessRequest, nullify ,,0..1,boolean,Remove history
ProcessRequest,Resource.DomainResource.ProcessRequest, reference ,,0..1,string,Reference number/string
ProcessRequest,Resource.DomainResource.ProcessRequest, item ,,0..*,BackboneElement,Items to re-adjudicate
ProcessRequest,Resource.DomainResource.ProcessRequest.item, sequenceLinkId ,,1..1,integer,Service instance
ProcessRequest,Resource.DomainResource.ProcessRequest, include ,,0..*,string,Resource type(s) to include
ProcessRequest,Resource.DomainResource.ProcessRequest, exclude ,,0..*,string,Resource type(s) to exclude
ProcessRequest,Resource.DomainResource.ProcessRequest, period ,,0..1,Period,Selection period
ProcessResponse,Resource.DomainResource.ProcessResponse, ProcessResponse ,,,DomainResource,"ProcessResponse resourceElements defined in Ancestors: id, meta, implicitRules, language, text, contained, extension, modifierExtension"
ProcessResponse,Resource.DomainResource.ProcessResponse, identifier ,,0..*,Identifier,Business Identifier
ProcessResponse,Resource.DomainResource.ProcessResponse, status ,?!Σ,0..1,code,active | cancelled | draft | entered-in-errorFinancial Resource Status Codes (Required)
ProcessResponse,Resource.DomainResource.ProcessResponse, created ,,0..1,dateTime,Creation date
ProcessResponse,Resource.DomainResource.ProcessResponse, organization ,,0..1,Reference(Organization),Authoring Organization
ProcessResponse,Resource.DomainResource.ProcessResponse, request ,,0..1,Reference(Any),Request reference
ProcessResponse,Resource.DomainResource.ProcessResponse, outcome ,,0..1,CodeableConcept,Processing outcomeProcess Outcome Codes (Example)
ProcessResponse,Resource.DomainResource.ProcessResponse, disposition ,,0..1,string,Disposition Message
ProcessResponse,Resource.DomainResource.ProcessResponse, requestProvider ,,0..1,Reference(Practitioner),Responsible Practitioner
ProcessResponse,Resource.DomainResource.ProcessResponse, requestOrganization ,,0..1,Reference(Organization),Responsible organization
ProcessResponse,Resource.DomainResource.ProcessResponse, form ,,0..1,CodeableConcept,Printed Form IdentifierForm Codes (Example)
ProcessResponse,Resource.DomainResource.ProcessResponse, processNote ,,0..*,BackboneElement,Processing comments or additional requirements
ProcessResponse,Resource.DomainResource.ProcessResponse.processNote, type ,,0..1,CodeableConcept,display | print | printoperNoteType (Required)
ProcessResponse,Resource.DomainResource.ProcessResponse.processNote, text ,,0..1,string,Comment on the processing
ProcessResponse,Resource.DomainResource.ProcessResponse, error ,,0..*,CodeableConcept,Error codeAdjudication Error Codes (Example)
ProcessResponse,Resource.DomainResource.ProcessResponse, communicationRequest ,,0..*,Reference(CommunicationRequest),Request for additional information
Provenance,Resource.DomainResource.Provenance, Provenance ,,,DomainResource,"Who, What, When for a set of resourcesElements defined in Ancestors: id, meta, implicitRules, language, text, contained, extension, modifierExtension"
Provenance,Resource.DomainResource.Provenance, target ,Σ,1..*,Reference(Any),Target Reference(s) (usually version specific)
Provenance,Resource.DomainResource.Provenance, period ,,0..1,Period,When the activity occurred
Provenance,Resource.DomainResource.Provenance, recorded ,Σ,1..1,instant,When the activity was recorded / updated
Provenance,Resource.DomainResource.Provenance, policy ,,0..*,uri,Policy or plan the activity was defined by
Provenance,Resource.DomainResource.Provenance, location ,,0..1,Reference(Location),"Where the activity occurred, if relevant"
Provenance,Resource.DomainResource.Provenance, reason ,,0..*,Coding,Reason the activity is occurringPurposeOfUse (Extensible)
Provenance,Resource.DomainResource.Provenance, activity ,,0..1,Coding,Activity that occurredProvenanceActivityType (Extensible)
Provenance,Resource.DomainResource.Provenance, agent ,,1..*,BackboneElement,Actor involved
Provenance,Resource.DomainResource.Provenance.agent, role ,Σ,0..*,CodeableConcept,What the agents role wasSecurityRoleType (Extensible)
